4973,2017-6-17 13:51 ,彤妹子快乐的乐,2893wuli瑶瑶呐,女大十一变女大十一变女大十一变女大十一变女大十一变女大十一变女大十一变女大十一变女大十一变女大十一变女大十一变女大十一变女大十一变女大十一变女大十一变女大十一变女大十一变女大十一变女大十一变女大十一变女大十一变女大十一变女大十一 
4974,2017-6-17 13:51 ,我家的我家的我家的神那,,我的是打车打车结束以后，司机发账单过来，直接自动扣费了 
4975,2017-6-17 13:51 ,提莫队长偷井盖,欧阳小艳子,你奶奶跳墙头摔死了吧 
4976,2017-6-17 13:51 ,都是我的人55,,是真的忘了付钱还是不想付？？我身边都有这种逃单的，一个手机号不付下一次打不了，然后就用同学的打车 
4977,2017-6-17 13:51 ,卖轮毂机箱的小伙子,淘专享优惠券自助搜,@滴滴出行 
4978,2017-6-17 13:51 ,叫我汪某某,,，一直开的是自动付费的， 
4979,2017-6-17 13:51 ,芥子化须弥,欧阳小艳子,层主毕竟是老人家，大家尊重点 
4980,2017-6-17 13:51 ,cHenCHhappy,,这种司机还能做滴滴，上天吧你！！！！ 
4981,2017-6-17 13:51 ,小北终结者,淘专享优惠券自助搜,没错啊，上次订单未付是没法再打车的。曾经过了快一个周，到下次打车的时候才想起来。司机也没催过。所以这就是那个司机的素质问题。 
4982,2017-6-17 13:51 ,Enoch艺哲,,我有一次十多天没付，直到又需要打车才付的，也没人催我 
4983,2017-6-17 13:51 ,爱谁谁SO,,低素质的人随处可见，国家的悲哀 
4984,2017-6-17 13:51 ,阿宏yer,,如果说不付款，下次是打不了车的，所以纯属是司机的问题 
4985,2017-6-17 13:51 ,你系死肥仔,欧阳小艳子,首先，司机这样明显错！ 其次，不是所有人都晚付款就代表这件事是对的！ 楼主，只能帮你到这！ 
4986,2017-6-17 13:51 ,凯泡儿,,这个没有必要的吧，我每次都会忘记，都是过了好多天下次打车的时候提示我才想起来的，就立马付了，没有司机来催的呀 
4987,2017-6-17 13:51 ,摩羯座鱼摆摆,,当事司机应该道歉 
4988,2017-6-17 13:51 ,林蹲坑大人,软妹呀,他们就是要喷啊…… 
4989,2017-6-17 13:51 ,借我更新,,当天忘了付不能当天提醒吗，非要闹那么大两方都不讨好 
4990,2017-6-17 13:51 ,FAIRYyxin,无感懒猫小柴豆,我有急事的时候也会忘 想起来就马上付了 
4991,2017-6-17 13:51 ,西贝雷斯之约,,我滴滴都是蚂蚁花呗自己扣款诶  
4992,2017-6-17 13:51 ,LiLi-bakery,,也有好司机，最近几次都司机打车忘记付钱，隔好几天之后打车才看到忘记付钱了，好师傅也没有催 
4993,2017-6-17 13:50 ,魏小o寞,,我也有一次忘记了，直到下一次打车才知道，而且期间没人打电话给我说没付钱的事，我还给了司机五星好评 
4994,2017-6-17 13:50 ,Rihanavy小金鱼,小眼巴巴,那你不也有忘记的时候？所以这是人之常情，而且女孩最后也付了，司机人品太差 
4995,2017-6-17 13:50 ,小木木zf,,我的滴滴都是自动支付的，再说，不给钱下次是打不了滴滴的，下次打滴滴之前必须把前面的钱给付了 
4996,2017-6-17 13:50 ,_高恩西的西,,素质与职业无关 
4997,2017-6-17 13:50 ,木木心若向阳,,有一次打滴滴都过了两天，收到滴滴公司催款信息，才打开滴滴软件，才知道自己忘记付款。还有一次要打车的时候，打不了，看行程才发现自己又一次忘记付款。付款才能打车。明明这司机态度就有问题。 
4998,2017-6-17 13:50 ,唯龙制胜,,真的会忘了，我表示 
4999,2017-6-17 13:50 ,若是一只锦鲤,欧阳小艳子,智障，社会就是多了你这种渣渣才变成这种乌烟瘴气的样子 
5000,2017-6-17 13:50 ,方丈大侠,,如果道歉有用的话，要警察干嘛！ 
5001,2017-6-17 13:50 ,大bing饼烁,,额...为什么我的滴滴都是自己扣 
5002,2017-6-17 13:50 ,Lina_Lyy,,还别说心大我自己经常玩着玩着手机就给忘了，但是如果不付款就再也用不了滴滴，不至于为了20块让自己一辈子都用不了滴滴吧，别觉得人家是故意不给，我就是经常忘记给的人，但是我想起了就马上给 
5003,2017-6-17 13:50 ,小清新王洛洛,,我看我要卸载滴滴打车了～ 
5004,2017-6-17 13:50 ,桃七七-,欧阳小艳子,你不知道滴滴的钱在下一次叫车之前付都可以吗？一看你就没用过 
5005,2017-6-17 13:50 ,黄正义fist,尒小鳥,希望你以后经常遇到这种司机，比较你和他可配了 
5006,2017-6-17 13:50 ,爱旅行的盲人,,那怪谁啊 谁让你粗心大意不给人家付钱……不过这司机也够缺德，我想问你这么灶你妈知道不？？ 
5007,2017-6-17 13:50 ,是喵宝啊,Tiger860508,正常好吗  明明是司机人品有问题好吗 
5008,2017-6-17 13:50 ,gocaa,,这个确定不是虚假新闻吗？滴滴司机是看不到乘客真实手机号的吧？我有次钱包落车上了司机送到派出所也不给我打电话，问为什么他说司机看不到乘客真实号码。还有滴滴打车延后付钱不是很正常吗？？？？ 
5009,2017-6-17 13:50 ,-Wwwweiyalan,欧阳小艳子,脑子是个好东西 
5010,2017-6-17 13:50 ,NZRY金小糖,lesliy2046,和吃饭两码事，类比应用不当 
5011,2017-6-17 13:50 ,KiKi艾奇,blingbling的Alice,我是女生我用过滴滴如果一次未付下次是不可以使用的 
5012,2017-6-17 13:50 ,_高恩西的西,,以前我没有下滴滴软件 用的微信第三方平台 我没注意微信上没钱 也不知道没有付款 都过了三天 别人滴滴师傅也只给我发了条短信 提示了我 我看见了就马上点进去看 发现真没付款 愉快的解决了 
5013,2017-6-17 13:50 ,FAIRYyxin,LIzzzz_z,都没脑子的 
5014,2017-6-17 13:50 ,阿开工作室,,司机有问题，警察有问题，滴滴公司也有问题 
5015,2017-6-17 13:50 ,MAVxISL,,你们好好看字行不行，说了卡里钱不够就没来得及付。司机一催就立马付了，付了后司机还在打电话骂读不懂中文吗？ 
5016,2017-6-17 13:50 ,林俊杰39岁要娶的女人,欧阳小艳子,小姑娘嘴巴这么脏，口活一定很好吧 
5017,2017-6-17 13:50 ,刘望望望望,,为什么我的滴滴是自动扣费？ 
5018,2017-6-17 13:50 ,_張貓儿,,有时上班打滴滴忘记了，下班才付，这玩意儿又赖不掉，这不正常么。 
5019,2017-6-17 13:50 ,ge倩倩,,我有事钱没扣 也是很晚才扣  车主也没说啊 
5020,2017-6-17 13:50 ,呆武518,牵你手好吗,不要侮辱人家特服行业好吧 
5021,2017-6-17 13:50 ,Neko酱-网易粑粑给我一个ssr,,司机骚扰乘客，警察要乘客换号？？？WTF 
5022,2017-6-17 13:50 ,爬啊爬的鱼胖胖,点点汪dog,我也是忘付了，自己第一次叫滴滴，然后下车时，师傅还说会自动支付。所以我以为付过了。刚才去看，没有 
5023,2017-6-17 13:50 ,vanilla-s795,淘专享优惠券自助搜,对啊，你不付清上一单的接下来怎么叫车，真是迷 
5024,2017-6-17 13:50 ,StayWithMe_Evelyn,,司机没素质 警察不作为 
5025,2017-6-17 13:50 ,_Angel妈咪,欧阳小艳子,当天忘记的也正常呀，我有次出国打车去机场，办理完登机就忘记了，到了才付钱。有时候遇到事情忙真会忘记。作为女性，你居然帮司机…难道你觉得20块钱你可以陪司机睡一次吗？ 
5026,2017-6-17 13:50 ,阿酒Joey,淘专享优惠券自助搜,我经常忘，一般下次叫车结算前一次的 
5027,2017-6-17 13:50 ,够糜盲吗,欧阳小艳子,滴滴不是自动扣费的吗？不付钱也会催的吧！ 
5028,2017-6-17 13:50 ,Wgt-18,,笑死我了，警方让女子换号。 
5029,2017-6-17 13:50 ,猫二宇你在一起,,20块卡里钱不够，，为什么没想问朋友借个微信支付宝什么的。。可怜啊 
5030,2017-6-17 13:50 ,鹤纸醉,,忘了付钱也是有的。我上次吃东西忘了付钱快走到家赶紧跑回去买单还有一次是打的20元我给了50直接下车了找零的钱都没拿然而司机也没叫我 
5031,2017-6-17 13:49 ,h兔小白,,回复@？？？？？？？？？？？？？ 
5032,2017-6-17 13:49 ,你好黑极熊,欧阳小艳子,真蠢，别拿无知当做蠢的理由 
5033,2017-6-17 13:49 ,马猴二锅头,我知道你超级喜欢我,坐滴滴我们会及时付款，过马路我们看到行人会停车礼让，看电影我们不会大声喧哗垃圾会带出场扔垃圾桶，有什么问题么 
5034,2017-6-17 13:49 ,lqhall,,本身是司机的素质问题  应该曝光这个司机 
5035,2017-6-17 13:49 ,丶小腻,,我默默的把滴滴设置成自动扣费模式了… 
5036,2017-6-17 13:49 ,Fish_佳,,……难道滴滴忘付钱不是常有的吗……又不是优步自动扣……这软件就是这样设置的，它没设置时效或者自动付费怪我们这些爱忘事的咯😳？而且迟早都还是要给的啊！谁为了一笔单一辈子不用滴滴啊？ 
5037,2017-6-17 13:49 ,FAIRYyxin,yss蝉鸣浅夏,真看出来了，这种人还愿意出来秀智商…… 
5038,2017-6-17 13:49 ,林澤玲aa,,滴滴自动扣费的好吗，如果没有第二次打滴滴是打不了的好吗，素质问题 
5039,2017-6-17 13:49 ,贝宝快长大,,吓得我赶快看一下滴滴有没有没付款的单。。。。其实没付很正常呀，有的时候大包小包的下车，就会忘记的，没付下次就打不了车，肯定会补上的，不知道 有什么好骂的 
5040,2017-6-17 13:49 ,很多座树屋,薄姑悠云,其实说起来我这心里还是有点难受的。对好人好事没有赞扬，对坏人坏事没有谴责。 
5041,2017-6-17 13:49 ,xzrl,淘专享优惠券自助搜,快车的话，确实是上一单不结，是没法再打车的，司机素质太低，感谢我打过的滴滴司机，我有忘的时候，直到再需要打车时候才发现未结，真不是故意的。 
5042,2017-6-17 13:49 ,張允強_,,司机素质低下。 
5043,2017-6-17 13:49 ,借我更新,万乘之君骑着驴,好警察付出的怎么没人夸呢？之前某星吸毒事件闹出来，倒一群人歌颂缉毒警察，现在又来骂了，就你们风向转最快。 
5044,2017-6-17 13:49 ,丶Linsey,淘专享优惠券自助搜,司机不对，但是感觉这女生也有问题，5月7号下午打车钱不够，那5月8号一整天足够的时间去存钱付款了，没嘀嘀神州的时候你看你身上没钱司机给不给下司机催钱并没有什么不对啊，不对的只是辱骂和挂名。 
5045,2017-6-17 13:49 ,杨小小鸡,,真的好可怕。。有次到外地去出差，我叫了滴滴，但是不知道酒店帮叫了车。就想跟滴滴师傅说不用来了。结果就被一直打电话骚扰，还说我别想出xx市问他想怎么样？他说不知道哦……好奇葩 
5046,2017-6-17 13:49 ,一鸣原味奶,,很多次敢动车下了车就忘了。都是隔几天付钱。那些喷女孩不付的你是活在大清穿越来的？ 
5047,2017-6-17 13:49 ,你也叫红豆么,,这司机平时加的都是什么群，正常人看到这种卖淫信息回去真的打么，可见一斑。 
5048,2017-6-17 13:49 ,桃七七-,欧阳小艳子,mdzz 
5049,2017-6-17 13:49 ,攀枝花土特产带够,,吓得我赶紧去把几天前忘付的给付了 
5050,2017-6-17 13:49 ,泡泡FFFFFF小姐姐,qiuqiumm,有的人打的自己东西还忘拿呢 
5051,2017-6-17 13:49 ,他的兔子没我快,欧阳小艳子,被人骂可以高潮 
5052,2017-6-17 13:49 ,谈股论金天,万乘之君骑着驴,喝茶 
5053,2017-6-17 13:49 ,益生菌和菌生益,,为何是期间反复？所以一直拖着还是忘了？有种人确实仗着自己是女性，是年轻女性，以为有点姿色，以为男人看到都走不动路了！以身为女性各种便利，不管别人接受与否！不特指这个女孩，但确实有！ 
5054,2017-6-17 13:49 ,向日葵上的猫a,欧阳小艳子,我日你妈！ 不好意思 素质在你这不见了 
5055,2017-6-17 13:49 ,哈哈今天星期5,HeyYBX,何况我本就是有急事才会坐滴滴 司机不结单我也无法立即支付，不知道这些说要立即支付的是什么情况，难道是司机？你们要真有拖欠费用的难处我们可以理解，但我自己也是信用极好的乘客（滴滴评的） 
5056,2017-6-17 13:49 ,懒猫猫想睡觉,,滴滴自己扣钱的，好吗！ 
5057,2017-6-17 13:49 ,拿一份爱给自己,qiuqiumm,人家有事急还不行，下次打车得时候肯定把这一次得付啦 
5058,2017-6-17 13:49 ,阳光下的女孩很迷人,万乘之君骑着驴,现在警察没用了 
5059,2017-6-17 13:49 ,大肥肥不拿拿,欧阳小艳子,你可能没用过滴滴 
5060,2017-6-17 13:49 ,一只布鲁啊,幸运风一样的啦啦啦,滴滴是不能逃单的。司机也是定时清理一次账单，不是天天都看。不是不给了，过几天打开滴滴必须把上一次的付了才能进行下一次滴滴。您打过滴滴吗？ 
5061,2017-6-17 13:49 ,酌酒再饮一两故事,,老子真是想锤爆这司机的狗头 
5062,2017-6-17 13:49 ,芳华落尽只为你,CV-马里奥,哈哈哈哈，这么多评论，就喜欢你的评论高 
5063,2017-6-17 13:49 ,yss爱在偷恋蔓延时,有人喊我小星星x,你用过滴滴吗？明显没有，用过的人说不出这个话 
5064,2017-6-17 13:49 ,张新晨,,滴滴现在司机这边都显示的是非乘客真实手机号，想不通司机怎么还能对外公布正确的手机号 
5065,2017-6-17 13:48 ,是喵宝啊,欧阳小艳子,忘记很正常的  我也是经常第二天点开才发现忘付钱了 滴滴不可能逃单的 
5066,2017-6-17 13:48 ,Boooomshi-,欧阳小艳子,你就是滩屎， 
5067,2017-6-17 13:48 ,Hollie_,,如此践踏法律，在司机眼中，法律是什么 在警察眼中，法律又是什么 
5068,2017-6-17 13:48 ,爬啊爬的鱼胖胖,,一看完，我赶紧去某宝看看我的支付了没有 
5069,2017-6-17 13:48 ,1998年12月06日,,吓得我赶紧把我的滴滴打车付了 
5070,2017-6-17 13:48 ,威尼斯的洱海,,忘记付钱，又不会拖太久。下次打车之前必须付清。司机素质太差了 
5071,2017-6-17 13:48 ,石南土著,,滴滴司机不是看不到乘客电话号码的吗？ 
5072,2017-6-17 13:48 ,王大花Lvy-,,我打滴滴有的时候就是下一次用的时候付款评价 
5073,2017-6-17 13:48 ,花开花落的悲哀,忙起来不是人,啊？笑死了？我的话有问题么？你难道没有忘记东西的时候？那个乘客在乘车后忘记付钱他是有责任，这不可否认，但是司机你在与乘客对话过程中辱骂乘客你不对，更可气的是把人家的联系方式公布出来，并且人家乘客遭到了骚扰，这些的等等体现了这个司机拙劣的素质，我说的难道不对？ 
5074,2017-6-17 13:48 ,疯狂的蟹蟹ChingLee,喵个泡,对呀拖那么久才付钱，我实在做不到本来就是10几，20几，几十块钱的事情，又不是给不起，我实在认为没有必要拖那么久我都是下车或者到家就把钱付上 
5075,2017-6-17 13:48 ,babe_qu,欧阳小艳子,怕是你没坐过车吧 
5076,2017-6-17 13:48 ,其实我是芒果-,幸运风一样的啦啦啦,楼下还有说下一单才付之前的，真是刷新我三观 
5077,2017-6-17 13:48 ,维维520134,,依我看，这TM的是个老司机。 
5078,2017-6-17 13:48 ,你猜我猜你猜不猜我是谁-,欧阳小艳子,你这种人就该去死 
5079,2017-6-17 13:48 ,Fannntastic,瑞Ruin,老了记性差了是不是 
5080,2017-6-17 13:48 ,Snowflakezyn,牵你手好吗,你感觉做鸭他够格吗 
5081,2017-6-17 13:48 ,骑着毛驴乱逛荡,,这个打车女孩在装屄，你以为你是谁啊？下车时不给钱，你还理由满满，你活该。 
5082,2017-6-17 13:48 ,C_佳媛,欧阳小艳子,间歇性失明？ 
5083,2017-6-17 13:48 ,古浪崽儿花花,,哎，司机那边布什不能知道我们的真实号码嘛？怎么公布到社交群的？ 
5084,2017-6-17 13:48 ,麤啊麤,,滴滴不是用的虚拟电话了吗？？为什么还能看到号码？？？ 
5085,2017-6-17 13:48 ,yss爱在偷恋蔓延时,朴泫惠,智障相当的多呢 
5086,2017-6-17 13:48 ,湯菲菲baby,欧阳小艳子,滴滴零钱都是自动扣 然后我也没看零钱有没有钱 我下次打车时就跳岀来 我才想起 
5087,2017-6-17 13:48 ,侶神经,,我经常都不是当场给钱的，等下一次要叫车才发现还没付款，哪里可以逃单 
5088,2017-6-17 13:47 ,射手座的lily果,,禁封也许是假的 
5089,2017-6-17 13:47 ,士多啤梨麦旋风好好味,,我之前也试过忘记付款，后来系统提示马上就付了，忘记能有什么奇怪？司机这行为还有人为他开脱也真是服了 
5090,2017-6-17 13:47 ,微胖的朱先生,,河南司机，河南女性，河南滴滴打车，666，井盖大省 
5091,2017-6-17 13:47 ,黄小仙Emm,,忘记付钱很正常好吧 又不是故意不付 
5092,2017-6-17 13:47 ,浅笑内悲伤123,,为什么警察告诉换号，这也太不负责了吧 
5093,2017-6-17 13:47 ,夏阳阳阳阳阳阳,,绑定了花呗付款。。。一 
5094,2017-6-17 13:47 ,IS8_,欧阳小艳子,脑子是个好东西 不是每个人都有 
5095,2017-6-17 13:47 ,sheepcorn,牵你手好吗,🦆 
5096,2017-6-17 13:47 ,哦你开心就好_,彬_司令,还好我路熟，本地土著 
5097,2017-6-17 13:47 ,超级candy2014,湯菲菲baby,看了这个新闻突然想到我昨天滴滴打车忘了付钱了 吓得我赶紧的打开支付宝支付 😹😹😹 
5098,2017-6-17 13:47 ,InHouse-潮公馆,,按理说应该电话号码是随机假号才对嘛？这种死机是不是应该送他个银手镯。免费监狱7日游呢？ 
5099,2017-6-17 13:47 ,阳光下的女孩很迷人,,这 司机真垃圾 
5100,2017-6-17 13:47 ,jl想睡觉,,凡事别只看一面！ 
5101,2017-6-17 13:47 ,宋妤乔,,我有过一次忘记付款 平时用的手机那天快没电了 免密支付的 怕车没到自动关机然后换了另一个打车 那个绑定的支付宝没设置 下车我就走了 因为平时从来都是自动扣 过了好几天我点进去滴滴 页面竟然是付款页面。。。然后吓得我赶紧付钱 不过现在手机号不是虚假的吗 怎么爆出来啊 
5102,2017-6-17 13:47 ,Yao·药君,药君yao,当然首先这个司机骂人诽谤公开手机号码是不对的，应该直接告他诽谤！ 
5103,2017-6-17 13:47 ,余生孤独一个吖,稳住我会有香香软软的女儿哦,我好无语。看上面那个有我的回复。 一个人。一直在说我。 
5104,2017-6-17 13:47 ,小仙女会发光哟-,,我得多幸运...忘付钱下次打车再付 师傅从来没骂过我🤗 
5105,2017-6-17 13:47 ,打击腐败6274344032,,滴滴公司应将这位素质差的司机赶出去 
5106,2017-6-17 13:47 ,AT不了我,星空在线,额，骂楼主的一定是没有经常使用滴滴，只能这么说 
5107,2017-6-17 13:47 ,自盲_,德莱文的媳妇儿丶,关键她也是女的真是 啧啧 
5108,2017-6-17 13:47 ,一时一时219,,我经常是下一次打滴滴的时候才发现上次还没付款，付完款才能打新的。所以没啥忘不忘，这个司机性骚扰而已。 
5109,2017-6-17 13:47 ,瑞Ruin,Fannntastic,一般都是急着有其他事忘了😄 
5110,2017-6-17 13:47 ,一颗来自外太空的智障星,淘专享优惠券自助搜,滴滴不是自动付款吗 
5111,2017-6-17 13:47 ,我是月儿月儿啊,,只有我是直接免密支付吗，省事方便还快捷 
5112,2017-6-17 13:47 ,Kate小姐愛吐槽,稳住我会有香香软软的女儿哦,滴滴公司不能给司机惩罚吗？必须禁开车一个月之类的……反正换电话号码这个我简直觉得…就是不想管了 
5113,2017-6-17 13:47 ,脑洞很大的呆呆,小辣椒长大后是西红柿, 我有一次忘了，刚好那段时间不打车，一个多月后才付😂 
5114,2017-6-17 13:47 ,Loveglasses68,欧阳小艳子,滴滴是不付款无法再打车的知道吗?你这样生活也很艰难吧 
5115,2017-6-17 13:47 ,调戏渣浪,hungry土豆,稳 
5116,2017-6-17 13:47 ,林辰依点,李李李李李璠,哪有人会花30买账号为了逃20块钱😂 
5117,2017-6-17 13:47 ,山西热心市民张先生,哦你开心就好_,前提你的知道你去哪的路怎么走……血的经验 
5118,2017-6-17 13:46 ,灰Vivian,,吓得我赶紧打开滴滴，看看有没有未付款的！ 
5119,2017-6-17 13:46 ,Sybil钰,,滴滴打车暂时忘了付也没关系呀，下次打车又打不了，就会想起来。所以司机…… 
5120,2017-6-17 13:46 ,a___da,,我上次打广骏车遇到比这糟糕太多，司机还对我动手了。事后报警警察让我找12345跟广骏先拿到司机身份信息再报警。广骏接线态度恶劣拒绝提供，12345敷衍说帮我登记。第二天我问发现根本没登记，在我连同12345一起投诉情况下，12345回复接线员已处理，广骏表示车是他们的，司机不是，无法处理。呵呵了 
5121,2017-6-17 13:46 ,yss爱在偷恋蔓延时,万乘之君骑着驴,要jc吃干饭 
5122,2017-6-17 13:46 ,微胖的朱先生,普通友人A,划重点，郑州，，河南郑州 
5123,2017-6-17 13:46 ,我知道你超级喜欢我,马猴二锅头,就你家家教好，你家老牛逼了，还是那句啊，别坐滴滴了，配不上你，别过马路啊，配不上你，别看电影啊，配不上你，你就继续在天上过吧 
5124,2017-6-17 13:46 ,柠晓溪一girl,Miss_吴o,我也是🤣🤣🤣 
5125,2017-6-17 13:46 ,一起吃早餐呐,qiuqiumm,喷子。你他妈能歇歇吗。草泥马。骂完感觉很爽， 
5126,2017-6-17 13:46 ,哇哈哈咿呀哟,欧阳小艳子,你是故意找存在感的吧 
5127,2017-6-17 13:46 ,悦己者艺术墙绘,qiuqiumm,你以后要是自己忘了一件事，就自己喷自己吧，好吧。服气！ 
5128,2017-6-17 13:46 ,Mikayla_L,正义野原新之助,所以观点不一样 我认为女孩没有信用问题 她只要在规定时间掏了钱就没问题 而滴滴的规定时间有两个 一个是硬性的 下次打车前不然无法使用 一个是滴滴公司系统提醒 黑社会借钱也会到时间才催钱 你见谁第一天借 第二天催的 所以女孩吃亏的只是滴滴的bug而已 而司机是明知缘故还无理取闹 纯粹就是为了发泄 
5129,2017-6-17 13:46 ,YhAiNan,,求别在给河南抹黑了 
5130,2017-6-17 13:46 ,时光未老浮生未歇,,我觉得都有错 
5131,2017-6-17 13:46 ,微胖的朱先生,,划重点，郑州，河南郑州，666 
5132,2017-6-17 13:46 ,偏偏孤倨引山洪i,,所以那些骂人家姑娘的有没有看完文章啊，你们的世界观我有点不太懂啊 
5133,2017-6-17 13:46 ,抠脚啃蹄儿,平安郑州, 
5134,2017-6-17 13:46 ,SuperMF-,欧阳小艳子,你可能是土鳖吧 
5135,2017-6-17 13:46 ,湯菲菲baby,,我也老忘付钱也没见人骂过 素质这么差 
5136,2017-6-17 13:46 ,雅克牛,,滴滴，你对司机的约束机制很不可靠。应该起诉滴滴。 
5137,2017-6-17 13:46 ,可可西里的可可888,,我好纳闷，滴滴打车的钱忘记付款的话，等你下次要滴滴打车的时候要把上次的付了才可以用啊！哪里会有司机催付款的！没有碰到过滴滴打车司机催付款的哦！ 
5138,2017-6-17 13:46 ,旧事甚歉L-,,喷子原地爆炸吧。 
5139,2017-6-17 13:46 ,陆小凰,榴莲芥末,至于为了20块的打车费换个手机号？ 
5140,2017-6-17 13:46 ,酥易西,Tiger860508,我还有隔一个星期付的呢 
5141,2017-6-17 13:46 ,这里黑夜静悄悄,,人肉这个司机 
5142,2017-6-17 13:46 ,c警员,点点汪dog,可以弄免密付款啊 我就是 支付成功都会给发短信的 
5143,2017-6-17 13:46 ,啊波次德efg,酷酷的辰丶,鸡八？真看得起他 
5144,2017-6-17 13:46 ,客栈小二的沙港,Jambalayago,  是这件事不？ 
5145,2017-6-17 13:46 ,是仙女味小可爱呢,小可爱仙女7, 
5146,2017-6-17 13:46 ,哈哈今天星期5,HeyYBX,有公交车我肯定先坐，我不知道你是不是设置的自动扣款这么智能，这个业务本就是滴滴出行提供给用户的一项服务，我享受到了且没有欠任何人车费这就是我的道理 
5147,2017-6-17 13:46 ,玲珑璻相思,,前段时间打滴滴那个司机一路说黄段，因为是陌生城市只能不理睬他，MD越说越过分还吹牛自己月收入过万，明里暗里想约炮，下车才送了一口气 
5148,2017-6-17 13:46 ,高小胖09,,坐车怎么不忘了？有些人就是想逃单 
5149,2017-6-17 13:46 ,9426一484一94,,？？？我都是打完车下一次要坐车的时候才付钱，这么严重啊？ 
5150,2017-6-17 13:46 ,chanel慧,,那我遇到的司机还挺好。因为每次滴滴过后我都不会及时付款。因为下次再用滴滴之前必须付了款才能再次打滴滴。 
5151,2017-6-17 13:46 ,微胖的朱先生,淘专享优惠券自助搜,划重点，郑州，河南郑州 
5152,2017-6-17 13:46 ,cdreds028,欧阳小艳子,你没打过滴滴？ 
5153,2017-6-17 13:45 ,或许我们真的需要一个空间,,我都是不是第一时间付的，等到下一次要坐车再付，有时候一星期才坐车，也没有这种事情出现呀 
5154,2017-6-17 13:45 ,爱薇的爱笑boy,,滴滴打车的车费，就算过几天付也没事的，好吧 
5155,2017-6-17 13:45 ,果子呀嘿嘿,万乘之君骑着驴,警察负责收钱的 
5156,2017-6-17 13:45 ,Yao·药君,我不告诉你呀你猜,偶尔一次没啥事，我不能理解的是评论好多人都是下次打车才会付这次费用！那我一般班车偶尔开车极少数打车，下次再打车再付款司机师傅是不是要等到明年了… 
5157,2017-6-17 13:45 ,河北土特产批发,,这世上确实有很多垃圾人，我们要做好自己份内的事，避免垃圾人…… 
