7621,2017-6-17 12:46 ,老三0908,,为什么我打滴滴都是自动扣费？？什么都不用操作，直接从银行卡里就扣了 
7622,2017-6-17 12:46 ,用户5497668,Harison_wang,同学聚会喝了点，本来就有点晕，我是真的冒雨跑回家就忘了，而且系统也没提醒催促我交费呢？这两天也真的没打车的时候，今天不看见这个根本想不起来了。幸好没遇到这种司机。 
7623,2017-6-17 12:46 ,不太好吃的黑椒牛柳,,警察也太不作为了吧 
7624,2017-6-17 12:46 ,_迷你球,欧阳小艳子,果然都骂你 挺好 
7625,2017-6-17 12:46 ,夜半秋凉了么,欧阳小艳子,一看你就没有用过滴滴 
7626,2017-6-17 12:46 ,只是一个别致的疯子,aaaaactorR,就是，丑不拉几司机 
7627,2017-6-17 12:46 ,爱未央better,,难道只有我每次坐车都是滴滴司机自动扣费？ 
7628,2017-6-17 12:46 ,王筱茹的旅行记,,我经常忘记付，然后下次打车时顺便付了，这多正常啊，有时候都过一个礼拜了。滴滴都实名制了，谁还能欠你几十块不成。 
7629,2017-6-17 12:46 ,Ma宝呗tthew_Tsai,欧阳小艳子,我每次都是下次用时付上次的 咋了 
7630,2017-6-17 12:45 ,肉Rose爷,,女孩记得及时给钱，这是基本；司机记得早点投胎，学学道德；滴滴记得长点心吧，第一时间给出积极处理，网络时代，别不当回事。警察嘛，爱咋咋地吧，老百姓指望不上了！ 
7631,2017-6-17 12:45 ,撸啊卢_,蒋美女-,肯定没有用过 
7632,2017-6-17 12:45 ,斐霏然染,,昨天打车的时候发现还真有一单没付钱，我都已经忘记是什么时候的了，可见时间久远。评论说女孩不是的都没用过滴滴吧。根本就逃不了单好吗。上单不付就没法使用下一次。这个司机是多弱智 
7633,2017-6-17 12:45 ,change我自己MYSELF,,每个行业都有垃圾，每个人都不一样，只能这样子说 
7634,2017-6-17 12:45 ,Jackie6051,,滴滴不是没钱也自动扣蚂蚁花呗的吗 
7635,2017-6-17 12:45 ,我的琪琪再也回不来,,我经常当时没付钱，等下一次打车自然就跳出来再付钱啊，没有一个司机催我 
7636,2017-6-17 12:45 ,YAAHNNG,,为什么我的都是自动扣款呢。 
7637,2017-6-17 12:45 ,树叶飘落的天气,,不作为吃空饷的警察和昨天牺牲的缉毒勇士反差真大。 
7638,2017-6-17 12:45 ,Vashtee-,牵你手好吗,哈哈哈 
7639,2017-6-17 12:45 ,晓戚七柒,,就真的挺容易忘记啊，有一次隔了一天再打开滴滴的时候才发现，司机也没催我啊……只是有个其他事打岔就忘了……这司机也简直了 
7640,2017-6-17 12:45 ,徐真彦,,打过几次滴滴，不超过十次，感受如下有两个看到短途拒载，有一个长途，不按里程强行加价，还有一个下车时把我的手机拿过去强行打五星。其它都很好。对了我也是个马大哈，生活中也经常忘记付钱。滴滴不付钱下次是不能打的。 
7641,2017-6-17 12:45 ,地上蹲个猴,,一个真恶心，一个真贱。 
7642,2017-6-17 12:45 ,Fourier粉丝团资深会员,,忘了付款不可能吧，不都有提示吗，要么最开始就设置自动付款 
7643,2017-6-17 12:45 ,MeU吴淑珍,磊磊不坏啊,嫩家天天被砸玻璃？要你也没一点逼用啊 
7644,2017-6-17 12:45 ,曼丫丫呀,欧阳小艳子,脑子是个好东西 
7645,2017-6-17 12:45 ,蕃子大大,欧阳小艳子,滴滴打车原来可以自动扣款，后来取消了，忘记付了不是正常？楼主卡里钱不够又不是不付，你戏有点多 
7646,2017-6-17 12:45 ,崽崽滴妈,,说女孩子有错的人是都没仔细看么？文里说了四级绕远路导致钱不够未能即使付款司机即辱骂女孩子，女孩子未回应司机而是付款，随后司机在付款之后泄露女孩子信息并称这是卖淫女。你们看懂没?? 
7647,2017-6-17 12:45 ,cole_lb,,警察太不做为了 
7648,2017-6-17 12:45 ,猫咪唤者,欧阳小艳子,额……我只想对你说脑子是个好东西，希望你能有 
7649,2017-6-17 12:45 ,-酒芯話,,我也是下次打车付上次的车钱。 反正付不了就不能打车的。 
7650,2017-6-17 12:45 ,nefertair,欧阳小艳子,脑残吗 眼瞎吗 没看到人家最后付款了吗 像你这种人以后遇到同样的事情活该被骂没处说理！ 
7651,2017-6-17 12:45 ,大鳄鱼的小狮子,,只用过专车，有一次我下车时要付钱，当时天黑了司机马上说不急，回家再付吧 
7652,2017-6-17 12:45 ,蓝海青葡,赵敏1061,人家说了司机绕路导致卡里钱不够了，所以当时不能付，再说不就隔了一天了吗下次打车再付款的有的是你没用过滴滴吧，女孩给钱了以后司机还在继续骂，你竟然觉得是女孩的问题？！ 
7653,2017-6-17 12:45 ,Doraemondl,,每天打滴滴上班的表示都是下次付上次的钱，目前还没碰到一次司机催款的，感谢这么多可爱的滴滴司机的不骂之恩 
7654,2017-6-17 12:45 ,Vashtee-,欧阳小艳子,垃圾 
7655,2017-6-17 12:45 ,飯大Q,欧阳小艳子,你生活一定很苦遇到的都是没素质的人，所以大家不要骂他，要同情她，因为楼主很可怜，没有过过好日子，不管做什么事都给人骂，给人侮辱，所以才能说出这些话吧 
7656,2017-6-17 12:45 ,-Fancye,Tiger860508,我有过两个月都没付第二次打车的时候才想起来的 
7657,2017-6-17 12:45 ,吴明松,,笑而不语 
7658,2017-6-17 12:45 ,人生若只如初见xxxi,,忘记付钱很正常啊  有时候上个楼就忘记该干嘛了… 
7659,2017-6-17 12:45 ,天亮好个秋丫,,不是说双方的电话号码都是屏蔽看不到的吗？ 
7660,2017-6-17 12:45 ,霖菇娘777,有人喊我小星星x,下次打滴滴时付不就好了，大多数都是这样的啦，什么故意不付钱。除非你以后都不用滴滴。那才是故意。 
7661,2017-6-17 12:44 ,伪同xue带你停药带你飞,,出租车，，， 
7662,2017-6-17 12:44 ,L金泰妍,,本来就是女孩的错了 
7663,2017-6-17 12:44 ,-Xw呐,qiuqiumm,真！键盘侠 
7664,2017-6-17 12:44 ,筱筱棋子,,都有责任，但是我是想这警察为何这么执法，心凉心寒 
7665,2017-6-17 12:44 ,我叫汤焕秋,,有一次自己也忘了，再打车的时候才看见忘了付钱 
7666,2017-6-17 12:44 ,我瞎你更瞎A,,滴滴打车虽然方便，但是司机得素质真的很差，有次叫了滴滴，结果手机没电，关机没发联系！在原地等了好一会，不知道哪个才是……后来没等到司机！结果那司机就打电话，骂了我一顿一直打 
7667,2017-6-17 12:44 ,阿龍看博,,司机素质太低，这乘客也是，记得坐车，记不得付钱。 
7668,2017-6-17 12:44 ,今天的你也很棒,淘专享优惠券自助搜,滴滴软件确实如此 
7669,2017-6-17 12:44 ,你好小雄雄,,司机太没品了! 
7670,2017-6-17 12:44 ,消失了的会员,欧阳小艳子,你用过滴滴打车吗 
7671,2017-6-17 12:44 ,眼睛下雨了丶,,真的是世界之大，无奇不有 
7672,2017-6-17 12:44 ,Katherine叽叽歪歪,,挨骂也活该，卡里有了钱不赶紧付车费不就等着挨骂么 
7673,2017-6-17 12:44 ,用户空山残月,_when_when_,如果法律就是，出现事情让被害人忍气吞声更，我宁愿没有法律，要那些执法部门何用 
7674,2017-6-17 12:44 ,特大左,,滴滴现在不是自动付款吗？ 
7675,2017-6-17 12:44 ,··2木··,欧阳小艳子,脑子是个好东西，希望你能有。 
7676,2017-6-17 12:44 ,情指深挑,欧阳小艳子,又一个土鳖横空出世。 
7677,2017-6-17 12:44 ,AdamLEveIN,,我经常打车忘记付，到下一次用的时候才发现，有时候滴滴会给我发个短信我看见了就会支付，十几块钱而且，你就这样骂人家可见素质多差 
7678,2017-6-17 12:44 ,诚实守信199910,,有的人几个月不付，而且是长途，不付的人心里肯定在想，我以后不打滴滴了，看你怎么着。 
7679,2017-6-17 12:44 ,大V服饰,,警察也不作为 
7680,2017-6-17 12:44 ,柏味源,,学学优步，下车自动付费 
7681,2017-6-17 12:44 ,Deja5vu2Eve0,,我有一笔一星期没付，司机都没来找我，我都不好意思了 
7682,2017-6-17 12:44 ,Deja5vu2Eve0,,我有一笔一星期没付，司机都没来找我，我都不好意思了 
7683,2017-6-17 12:44 ,没用的号-,,两个人都有错 
7684,2017-6-17 12:44 ,赵敏1061,Joveng,刚才明白，滴滴怎么回事，我就用过一次 
7685,2017-6-17 12:44 ,小公主家的姑姑,,每次都是自动付款，一下车就扣费，绑定银行卡 
7686,2017-6-17 12:43 ,夜如何其灬夜未央,,脑残司机 
7687,2017-6-17 12:43 ,Forener_MiG宝,-Fancye,我是经常，尤其是赶时间的时候，下车就走了，经常到下次坐车一看又有未付的单 
7688,2017-6-17 12:43 ,暴走的大寿司,欧阳小艳子,你这种人就是来找骂的 
7689,2017-6-17 12:43 ,静疯舞12138,qiuqiumm,呵呵，没用过吧，孩子 
7690,2017-6-17 12:43 ,银喰,欧阳小艳子,你是个烂人 
7691,2017-6-17 12:43 ,爱学习的朱慧,欧阳小艳子,你以为天下人都像你是个乖乖仔吗？没有社会茅盾怎么会有法律和警察呢 
7692,2017-6-17 12:43 ,阿啾啾啾啾呀_,Tiger860508,隔一天怎么了？实名制的，司机根本不用担心好嘛，忘记了这种事情，不是忘记几个小时就能想起来的 
7693,2017-6-17 12:43 ,飯大Q,欧阳小艳子,忘记付款不是不付款！我都试过。有几次匆忙下车，转身就忘记了。也许我运气好没有遇到那么没素质的司机。也没有人催我。都是晚上不小心按到滴滴app才发现没有付款马上就付了！ 
7694,2017-6-17 12:43 ,HEY我在这FFF,欧阳小艳子,看到那么多人骂你我就放心了 没用过滴滴就别乱说话好吗 
7695,2017-6-17 12:43 ,余生好长你好忙,欧阳小艳子,你是没看全文吧 
7696,2017-6-17 12:43 ,1314龙舟,,他妈或许他老婆或子女遇有事，匆忙忘了支付钱那就培人睡上一觉，该回想？他素质与信念。 
7697,2017-6-17 12:43 ,沉沉777,,吓得我赶紧打开滴滴看了看。 
7698,2017-6-17 12:43 ,徐爽爽哎,,感觉上次遇到的司机素质太好了三个月没用过滴滴上面有二十开多没付。那天要用滴滴才看到。 
7699,2017-6-17 12:43 ,渊博的二哥足球,万乘之君骑着驴,呵呵呵 还有替警察说话的 无语 智商是硬伤 
7700,2017-6-17 12:43 ,李氏家族诞生,,以牙还牙，把他的车牌号公布出来，人肉搜索他 
7701,2017-6-17 12:43 ,寒江不眠夜,,打滴的都是有钱人， 
7702,2017-6-17 12:43 ,万喜控股,,河南吗？ 
7703,2017-6-17 12:43 ,曾钿钿,欧阳小艳子,我经常忘记，隔天发现才还，司机却信任我 
7704,2017-6-17 12:43 ,青青青儿716,,我第一次用滴滴也搞不清楚，后面直接用现金付的，忘记而已，根本就是司机素质问题，因为我也有类似的经历， 
7705,2017-6-17 12:43 ,全国人民打麻将,皖西吃货,嗯，这司机是坏逼 
7706,2017-6-17 12:43 ,凱西_KK,¡,评论配图 
7707,2017-6-17 12:43 ,我不是谁的乖宝宝,,没有人性 
7708,2017-6-17 12:43 ,凯威威威威,,这种事都可以忘  以是服 
7709,2017-6-17 12:43 ,墨墨0629,淘专享优惠券自助搜,是的，这单不结清就不能继续使用了，逃不掉的。 
7710,2017-6-17 12:43 ,柏味源,淘专享优惠券自助搜,好多不付钱照样坐车 
7711,2017-6-17 12:43 ,白刃入梦极,,打车不给钱人家骂几句都不行？谁不是辛苦出来工作凭什么忘了给就是理由？ 
7712,2017-6-17 12:43 ,阳颠爱吃肉的思密达,欧阳小艳子,请问你有脑子没，脑子是不是丢茅坑里了，现在在你脖子上的是一坨屎吧 
7713,2017-6-17 12:43 ,北巷小麦,,喷女孩子的那些你们真的对滴滴打车这个软件了解吗？ 
7714,2017-6-17 12:43 ,冬季冰美人,Tiger860508,我也经常忘记， 
7715,2017-6-17 12:43 ,不桐屹,,我也经常忘记，不过庆幸没遇上这样的司机 
7716,2017-6-17 12:42 ,Letty_湉,欧阳小艳子,失误你麻痹，你这种人还是不要滴滴吧，司机师傅可能会强奸你的嘴 
7717,2017-6-17 12:42 ,主动久了我也会累的,酷酷的AF,我也是，每次都觉得好不好意思，天啊，我居然忘记付款了。 
7718,2017-6-17 12:42 ,Lilorepublic,万乘之君骑着驴,你搞笑了吧 你钱被人偷了叫你保管好自己的私人财物怎么就变错的了？？ 
7719,2017-6-17 12:42 ,南有乔木one,欧阳小艳子,是的 看到那么多人骂你我就放心了 
7720,2017-6-17 12:42 ,静疯舞12138,淘专享优惠券自助搜,对呀 
7721,2017-6-17 12:42 ,路虽长却有尽头,,现在这出租车司机绕远路，乱要价，还有威胁乘客的，动手的，层出不穷。 
7722,2017-6-17 12:42 ,中国物业时报,,这个事例再次证明，某少数出租车（含网约车）司机的素质堪忧！ 
7723,2017-6-17 12:42 ,又禾又禾,Tiger860508,正好是高考的两天，说不定这孩子是高考的学生，第一天考完忘了付钱也情有可原 
7724,2017-6-17 12:42 ,May十一月,欧阳小艳子,你是真特么的丑 
7725,2017-6-17 12:42 ,风平浪静的眀天,淘专享优惠券自助搜,就是素质问题，并不是每个司机都是三观正 
7726,2017-6-17 12:42 ,Csss_player,欧阳小艳子,大家别喷层主了，他用的是小灵通，不会上网，更不知道滴滴怎么付钱。 
7727,2017-6-17 12:42 ,手机用户1460777485,,总是有不付钱得主! 
7728,2017-6-17 12:42 ,Catherine潘潘潘,淘专享优惠券自助搜,送你上去 
7729,2017-6-17 12:42 ,风梦无痕1,万乘之君骑着驴,邪念来自于人心，警力只能控制，而非杜绝，要是警察干掉了所有暗黑势力，那他存在的意义是什么，人心向善没错，但社会就这么现实，懂吗。 
7730,2017-6-17 12:42 ,茶糖,点点汪dog,支付宝免密啊，你值得拥有，虽然我也忘记我怎么设置的了 
7731,2017-6-17 12:42 ,在世界之外h,有人喊我小星星x,我看你也差不多，都说了滴滴上一次没有付款的话就不能再使用滴滴打车，女孩故意？除非她再也不用滴滴打车 
7732,2017-6-17 12:42 ,段子手小孙,,为啥一群人说自己每次都是下一次打车才付上次说的理直气壮的？ 
7733,2017-6-17 12:42 ,lhj1123,淘专享优惠券自助搜,不懂别乱说 
7734,2017-6-17 12:42 ,Tian朝de良民,Tiger860508,我上次还隔了一个月呢。这种事就是容易忘记啊 
7735,2017-6-17 12:42 ,幸运风一样的啦啦啦,点点汪dog,我真佩服你们这些忘付钱还说不骂人的司机有素质的人 
7736,2017-6-17 12:42 ,酒酒_pp,,我也忘记过，如果当下有事就容易忘记，事后付款就是。司机素质确实不好。 
7737,2017-6-17 12:42 ,哎呦喂我就是我,,我也有一次忘付款了，知道三天后再次使用才发现 
7738,2017-6-17 12:42 ,静疯舞12138,欧阳小艳子,呵呵，你个辣鸡 
7739,2017-6-17 12:42 ,赵敏1061,醉始梧桐月下愁,别祝愿我，你还是祝愿那个女孩子吧 
7740,2017-6-17 12:42 ,杨柳岸晓风ivy,赵敏1061, 
7741,2017-6-17 12:42 ,有空一起喝可乐,,回复@？？？？？？?????? 
7742,2017-6-17 12:42 ,我是大大Q,万乘之君骑着驴,狗警察 
7743,2017-6-17 12:42 ,-Fancye,欧阳小艳子,看你这辈子是没忘记过东西 
7744,2017-6-17 12:42 ,Forener_MiG宝,欧阳小艳子,一个连胸都是A的“优秀”女子，优秀一词，呵呵……估计你脑子很你胸一样是没有的。 
7745,2017-6-17 12:42 ,阿啾啾啾啾呀_,欧阳小艳子,怪不得要这样说，淘宝店主啊，这样也没人去你店里买东西的 
7746,2017-6-17 12:42 ,我还在你身后等你回头,Lovit_-,对不起正因为不苦我才不会欠钱 
7747,2017-6-17 12:42 ,Joker丿小丑喵,探戈轲,厉害了 
7748,2017-6-17 12:42 ,侒丶董,欧阳小艳子,sb 
7749,2017-6-17 12:42 ,千禧曼波er,,我就碰到过顺风车故意不给钱的 
7750,2017-6-17 12:42 ,炸酥肉和红烧肉,,我经常下次打车才付上一次的 又不是故意不给 
7751,2017-6-17 12:42 ,六肆_,欧阳小艳子,你有病吧 
7752,2017-6-17 12:42 ,小仙女不知所措,点点汪dog,我也是我也是 有时候都是下雨心急慌忙打车去上班或者有事出去，结果忙着忙着都忘了付钱这事儿…等我下一次打车才会发现上一次钱还没付😂赶紧付钱好评～ 
7753,2017-6-17 12:41 ,宇歌哥儿,欧阳小艳子,sb 
7754,2017-6-17 12:41 ,Ynee-,,忘记了这么很正常，我的是自动扣款，以为扣成功了，结果等下次打车的时候才发现上次车费未支付成功。这是跑不了单的，怎么司机可以变态成这样 
7755,2017-6-17 12:41 ,大风来来来来里,正义野原新之助,滴滴的支付有一个24小时的支付时间，而且这个女人后面付了钱，又不是没付。 
7756,2017-6-17 12:41 ,请你安静下来_,,多的是这样的人，我室友也碰到过这种类似的事 
7757,2017-6-17 12:41 ,迈不开腿的圆小团,,我都是免密支付，直接扣钱，方便 
7758,2017-6-17 12:41 ,我还在你身后等你回头,阿琪长期招网拍模特hhh,谁是受害？被欠钱的还是被骂的？两个好像都不好吧 
7759,2017-6-17 12:41 ,茶糖,牵你手好吗,鸭子？？？？我起码长的帅啊 
7760,2017-6-17 12:41 ,Cammi吖蚊,欧阳小艳子,该吃点核桃补补脑，这么简单的题都看不懂！ 
7761,2017-6-17 12:41 ,你好_阿庆,,看到说一个巴掌拍不响的，真是三观叽歪啊。。。就像你被强奸，还要怪你穿得少，难道夏天你还得裹几件厚厚大衣？ 
7762,2017-6-17 12:41 ,MD_刘宇宁的小钢炮,欧阳小艳子,没用过滴滴吧？ 
7763,2017-6-17 12:41 ,赵敏1061,杨柳岸晓风ivy,理解什么意思了，平日我自己开车，滴滴我就用过一次，不开车得时候喜欢打车，觉得简单，你这么说我就明白了。 
7764,2017-6-17 12:41 ,Review_yz,,我经常忘了呀，然后等下次坐车才发现没付，反正不付也叫不了下一单 
7765,2017-6-17 12:41 ,我爱小忧郁,,滴滴可以下车再付的啊 
7766,2017-6-17 12:41 ,华申Janet,,我打滴滴也经常忘记付钱的，人人都有记性不好的时候，有些人干嘛说话那么难听，谁会因这一点小钱故意不给的！警察也忒不给力了…… 
7767,2017-6-17 12:41 ,yyttt丶,,所以我喜欢用滴答，滴滴的个别司机素质真的很差！ 
7768,2017-6-17 12:41 ,花痴大小姐,淘专享优惠券自助搜,幸好我遇到的滴滴司机是好人，有一次因为下着雨又有急事打了个快车，下车时也告诉司机了等我空了给他付款，结果这一忙给忘了，等好几天后我又需要打车，看到未支付订单才想起来，赶紧给付了😱 
7769,2017-6-17 12:41 ,杨大帅帅好帅呀,,吓得我看了一眼滴滴 
7770,2017-6-17 12:41 ,Lovit_-,正义野原新之助,你日子过得应该很苦吧，都没有用过滴滴 好可怜 
7771,2017-6-17 12:41 ,霖菇娘777,,我也有一单没付啊，又不见别人来催 
7772,2017-6-17 12:41 ,余洪飞3302477951,欧阳小艳子,司机也不是什么好鸟，有时候忘了付款也是有的，但没有人恶意的，超过时间，滴滴就会联系你的 
7773,2017-6-17 12:41 ,郑刚童鞋,,诶，我发现现在的人都挺机灵的，不像以后老了会得什么健忘症啊老年痴呆症啊什么的，可是以后也说不准啊。为什么都说怎么会忘了怎么会忘了？那些人脑子是有1TB的容量吗？做过的任何事都不会忘的吗 
7774,2017-6-17 12:41 ,其貌不扬de甲乙丙丁,,我很多时候也都会忘记，有时候甚至是在下次用的时候才想起来感谢那些一直包容我的滴滴师傅们 
7775,2017-6-17 12:41 ,迈不开腿的圆小团,Tiger860508,我都是免密支付，直接扣钱，方便 
7776,2017-6-17 12:41 ,Joveng,赵敏1061,滴滴没付款前下次是不能下单的，除非她一辈子都不坐 
7777,2017-6-17 12:41 ,长要快乐,,晚了付费应该交滞纳金，骂人了人要赔理道歉。 
7778,2017-6-17 12:41 ,三木有一撇,欧阳小艳子,还有那么多人赞你，看你也是有孩子的人了，看你孩子以后遇到这种事你怎么办。go嘴里吐不出象牙 
7779,2017-6-17 12:41 ,冬季冰美人,欧阳小艳子,我也经常忘，下车的时候弄着孩子，回到家一忙真就给忘了，有时候司机给短信赶紧付了，有时候突然想起来了赶紧付款，经常这样，打车的时候通常一个人弄着小孩拿着东西， 
7780,2017-6-17 12:41 ,JUANSHU陳,欧阳小艳子,看到这么多人骂你我就放心了 
7781,2017-6-17 12:41 ,一定要有个昵称嘛,,看评论总感觉自己活在一个可怕的世界里 
7782,2017-6-17 12:41 ,Dhxfgcfdsd,,还要人家司机道歉声明，我看你是真的皮 
7783,2017-6-17 12:41 ,毛小毛的大厨师,,我有一次坐车忘记付了，估计一两个月了才再次打车发现没付钱就赶紧付了，司机也没任何骚扰之类的，看了这新闻，真心感谢我那个司机这么有素质 
7784,2017-6-17 12:40 ,阳光下77微笑,欧阳小艳子,我就是进来看看评论的，看别人是怎么骂的你，哈哈 
7785,2017-6-17 12:40 ,茶糖,,支付宝免密你们值得拥有 
7786,2017-6-17 12:40 ,一枚经理是不速之客,,我每次打滴滴都会在下次再打滴滴付款，就是懒，这样会不会被滴滴司机骂死 
7787,2017-6-17 12:40 ,_PopNLee,,这警察厉害了。 涉事司机不出现 我们没办法 你换手机号吧。我操厉害了  国家就是养两条狗也会冲对面吠两声吧。这种警察 
7788,2017-6-17 12:40 ,树谙i,,我上次遇到一个滴滴新司机，我下单以后他过来接了我都送到目的地下车了我才发现他没有确认接单，他自己估计都不知道……就是说这单他白跑了，我只好打电话给他把钱转给他 
7789,2017-6-17 12:40 ,李萫蘭,,自动扣费的人表示理解不了 
7790,2017-6-17 12:40 ,一瓶有年头的假酒,一抹茶香淡淡的song,你都知道你卡里钱不够不会给司机打个电话说卡里现在没钱 过一会再发给你  来这句话都不说 她这个人有问题 
7791,2017-6-17 12:40 ,妖魔的小怪,淘专享优惠券自助搜,我经常忘了付款直到需要下次用车的时候 
7792,2017-6-17 12:40 ,偷看就偷看别手滑点了个赞,Tiger860508,我下次打车才会付上次的钱 
7793,2017-6-17 12:40 ,可爱的欧娇,,你准时给钱会有后面的事发生？ 
7794,2017-6-17 12:40 ,耶耶耶耶耶耶s,淘专享优惠券自助搜,博主说的很正确。你们可以自己看看 
7795,2017-6-17 12:40 ,石榴十六颗,,为什么评论里都说忘了付钱很正常？难道不应该打完出租就付钱吗？直接付钱才是最正常的不是吗？ 
7796,2017-6-17 12:40 ,守护九亿少男的梦,吃南瓜的猫150906,我之前经常忘记，后面也索性设置了自动付款。 
7797,2017-6-17 12:40 ,你好像你像我,qiuqiumm,你用过滴滴？或者说你是司机本人吧！ 
7798,2017-6-17 12:40 ,刘燃龙,,忘付钱很正常呀！再说滴滴那里会垫付呀，25块钱而已，也不至于那么说话吧，素质问题，这样的人挺恶心的！ 
7799,2017-6-17 12:40 ,XIAOLINGSU_,,有时下车我也会忘记 ，很正常吧这司机素质有问题。 
7800,2017-6-17 12:40 ,忘怕,滴哩哩哩叻,她那句话本身有毛病。主要说为什么忘记付钱。然后才转过来说了句都有问题。打出租车吧，绝不会忘记付款！ 
7801,2017-6-17 12:40 ,你怎么那么中二,,e，记得3年前有次晚上打车网超级不好，司机师傅说没事儿，你到家连上wifi再支付就行。另一个司机师傅是，我刚下车就支付成功了，第二天司机给我打电话说我没支付，我说我支付了呀，他就说我逃车费，这气的我呀，后来我短信发给了她支付宝的付款截图。 
7802,2017-6-17 12:40 ,朵顏三衛,万乘之君骑着驴,最恶心的是警察不作为你还拿他没办法 
7803,2017-6-17 12:40 ,萌兔兔爱吃萝卜,欧阳小艳子,数学老师教你语文的？文字都没看完就知道喷，你的智商令人堪忧 
7804,2017-6-17 12:39 ,柚柚柚零,,我打滴滴都没等我付钱微信就自己扣了 
7805,2017-6-17 12:39 ,Disrich-小润,,我去年滴滴打车叫的快车 下车我付完现金走的 然后到现在我都不能再叫快车 说我没给钱 ¡评论配图 
7806,2017-6-17 12:39 ,噢油呵,,这个陪睡好廉价 
7807,2017-6-17 12:39 ,醉始梧桐月下愁,赵敏1061,祝你一辈子都不要忘记任何事 
7808,2017-6-17 12:39 ,carina--zhu,榴莲芥末,你会为了逃一点打车费就要换个手机卡吗 
7809,2017-6-17 12:39 ,_旗鼓隆冬呛咚呛,,看了这么多评论，最好的办法就是设置小于200免密支付，手机没电，忘记付款，赶时间.....都可以解决 
7810,2017-6-17 12:39 ,淡定人生05222,,警察不去惩治涉嫌犯罪的司机，反而建议受害者销号？ 
7811,2017-6-17 12:39 ,巧克力甜酒Amachan,,我的滴滴咋是直接付费？免密？ 
7812,2017-6-17 12:39 ,想家的孩纸,,找不到人？换号？现在这社会是怎么了？ 
7813,2017-6-17 12:39 ,Lucky9131,,这种人的道歉有什么好要的，不觉得恶心啊。要实质性的惩罚才有用。 
7814,2017-6-17 12:39 ,1样的月光,,滴滴的电话不是虚假来电嘛？ 
7815,2017-6-17 12:39 ,重巡洋舰衣阿华x,,河南人啊 
7816,2017-6-17 12:39 ,Bleak69,qiuqiumm,没用过嘀嘀打车？ 
7817,2017-6-17 12:39 ,TT清涩,欧阳小艳子,大家举报她 
7818,2017-6-17 12:39 ,王素素yay,,确定是忘记了吗？虽然司机很low，但是对于忘记这个词。我也不是很相信。 
7819,2017-6-17 12:39 ,柳-阿柳,欧阳小艳子,看见这么多人骂你我就放心了 
7820,2017-6-17 12:39 ,一瓶有年头的假酒,录小爷,不要张口闭口的就是屌丝   就你这态度 放到小说里活不过10章 
7821,2017-6-17 12:39 ,阿显xianxian,qiuqiumm,妈的智障 
7822,2017-6-17 12:39 ,星梦之下的小吴A,,好真的是没素质的滴滴司机 
