2413,2017-6-17 19:45 ,诚实的世潮,,我们应该对这种垃圾类人员进行严惩，让他们付出代价，不敢再犯。 
2414,2017-6-17 19:45 ,Haeley_Hi,欧阳小艳子,你说出这句话的时候就已经暴露你负亿分的智商。 
2415,2017-6-17 19:45 ,碎情戊影,,睡就睡，把鸡鸡切了下酒 
2416,2017-6-17 19:44 ,末子89,卐大統領卍,哈哈 
2417,2017-6-17 19:44 ,骉龘-,,没有滴滴的时候下车就付钱，有了滴滴下车钱不够就可以“忘记”付钱？聊天记录只有司机的，看得出来不是自言自语而是在对话，把自己发的话都删了只留下司机的，是不是自己也知道不删自己不会被同情？？司机能不能站出来复原一下对话让大家看看到底发生了什么好吗？？ 
2418,2017-6-17 19:44 ,如果ulxc,,我很佩服底下一大堆忘记付款的人！你们打车不付钱吗？吃饭不付钱吗？什么都一句忘记了？ 
2419,2017-6-17 19:44 ,__元气元气元气柒,欧阳小艳子,看到大家都在骂你我就放心了 
2420,2017-6-17 19:44 ,鲜嫩小肥肉,我不告诉你呀你猜,上车前检查自己的余额，下车付款。我觉得是打车的基本流程 
2421,2017-6-17 19:43 ,T豬豬S,欧阳小艳子,看到有那么多人骂你我就放心了 
2422,2017-6-17 19:43 ,邪恶的羊美美,欧阳小艳子,晚点儿给等于不给？？？ 
2423,2017-6-17 19:43 ,传说哥V,,再怎么说，网约车比出租车安全，至少都有记录 
2424,2017-6-17 19:42 ,故事里c,,人品有问题 
2425,2017-6-17 19:42 ,七零八落小清新,,有时候着急也会忘，如果不付清下次打车必须要付清的啊，哎！看来号码应该保密 
2426,2017-6-17 19:42 ,胖ly,Fannntastic,对啊，那么多人不及时付款还可以那么理直气壮的说忘记了 
2427,2017-6-17 19:41 ,王夫人李,,男的真是有病 
2428,2017-6-17 19:40 ,一颗努力的杏仁,用户空山残月,惹不起，真是惹不起，靠他们都不如靠自己。 
2429,2017-6-17 19:40 ,庄晓旭丶,,出租车的反击 
2430,2017-6-17 19:40 ,煜林小儀,,每次打滴滴都是自动扣费，这司机自己不收怪谁 
2431,2017-6-17 19:40 ,人工智能与大数据分析,邵美玉May,垃圾警察真他妈多 
2432,2017-6-17 19:39 ,小小宝贝娥,,我之前一次可能忘支付了，我那天打滴滴的时候他说有一笔钱忘支付了，然后我支付了一样可以滴滴打车啊，又没有催 
2433,2017-6-17 19:39 ,Ss小LL,,妈呀，吓得我赶紧翻了一下，竟然7号还有一张订单忘记付钱，尴尬了 
2434,2017-6-17 19:39 ,我还不太认识我自己,等公交哒猫,看到这条，突然一阵恍惚。脑子里闪现出看到过熟悉的一幕。但感觉告诉我是发生在三年前的事了。可为什么又出现了同样的画面～～文字情境完全一样。好像是什么深层的记忆被唤醒。有些诡异！ 
2435,2017-6-17 19:39 ,这世界给我的幽默丶Reira,我当时都无奈了。。滴滴不付钱不能再叫车的 我能不给么,真的有这种人 
2436,2017-6-17 19:39 ,昔临风下,淘专享优惠券自助搜,好奇怪，我打滴滴都是自动扣款的耶，现在才知道还可以自己手动支付？？？！！一脸懵逼 
2437,2017-6-17 19:39 ,人工智能与大数据分析,点点汪dog,有些人真是脑子有问题，占边司机，平时也就没素质的人吧 
2438,2017-6-17 19:38 ,困困同学_,庆余屯村霸, 
2439,2017-6-17 19:37 ,一个达先生,点点汪dog,我也赶紧看了一下，上次用现金付了的，打开一看，显示司机已现金收取 
2440,2017-6-17 19:37 ,lyly宝宝贝贝,,今天刚被滴滴司机甩单厦门下大雨又限行车开不了叫的滴滴专车告诉他在酒店的咖啡店门口等还没等我说完司机就挂电话，虽然心里不舒服但也没在意。司机到啦给我打电话说在酒店门口，我说你拐出来我在咖啡店门口，直接从这边就走啦，酒店到咖啡店门口开车过来不用一分钟结果我没说完司机直接挂电话取消订单 
2441,2017-6-17 19:37 ,木易尹Ro,,有时候真的会忘记付钱的，忙起来的时候完全会忘记这回事，但是到几天后滴滴会发短信提醒付款的，这个时候付款完全没问题呀！并且你不付款下次根本不能打车好吧！这个司机是怎么了？？？？ 
2442,2017-6-17 19:36 ,梦里你是盖世英雄,,滴滴不是直接就扣钱了吗 
2443,2017-6-17 19:36 ,活泼可爱滴小鱼儿,欧阳小艳子,看到都在骂你，我就放心咯 
2444,2017-6-17 19:36 ,我是布呐呐,欧阳小艳子,所以小学没毕业的原因是看题看一半？ 
2445,2017-6-17 19:35 ,人工智能与大数据分析,万乘之君骑着驴,这种垃圾警察一抓一大把，都他妈吃干饭的，好警察只在少数 
2446,2017-6-17 19:35 ,大漠苍狼好孩子,,这是滴滴司机的文化素养问题，望有关部门加强服务行业从业人员的素质考核，使各，服务行业从业人员在文明中国站住脚跟。 
2447,2017-6-17 19:35 ,思宝最可爱,,评论里好多人没用过滴滴就在这里对女孩指指点点，多么直白的显示了现在多少人上网不带脑子，只会随意乱喷 
2448,2017-6-17 19:34 ,柯愉丶,,说问题出在女孩身上的你的脑子可真棒啊。 
2449,2017-6-17 19:34 ,挤不上公交的路人乙,,手机号不是都被屏蔽了吗 只能拨打 看不到号码 
2450,2017-6-17 19:34 ,eliza_lin,,有次我妈打车用的滴滴，下车时忘记了直接付的现金，结果后来再想用滴滴时，只好又付了一遍车费 
2451,2017-6-17 19:34 ,柯愉丶,qiuqiumm,你脑子可真棒啊 
2452,2017-6-17 19:33 ,奈叩neko,欧阳小艳子,你脑子瓦特了吧 我也经常会忘记的 下次坐车付掉就好了 人又不差这20块钱 
2453,2017-6-17 19:33 ,Lcccccccccl-,,吓得我赶紧去滴滴看看付钱了没 
2454,2017-6-17 19:33 ,吴亦凡的小钢炮--阿秋皮,朱爱文啦,我就是死盯着付的那种大太阳的看不到屏幕还手遮挡着给因为我确实怕忘记 
2455,2017-6-17 19:33 ,柯愉丶,欧阳小艳子,你脑子可真棒啊 
2456,2017-6-17 19:33 ,Eason大鹏,,让我想起来某主播撩滴滴司机，震了半小时。 
2457,2017-6-17 19:32 ,沉醉你的敷衍,,司机必须道歉，这是侮辱人格 
2458,2017-6-17 19:32 ,吴亦凡的小钢炮--阿秋皮,我不告诉你呀你猜,我舍友！超屌的，她就是那种不是忘记，是拖着！能尽量晚给就晚给的那种，我都醉了，有次提了一下，她口气很冲的说等会给会死啊 我内心退一步海阔天空 
2459,2017-6-17 19:31 ,你的鞋吗,也不念·,你应该没做过滴滴吧 
2460,2017-6-17 19:31 ,风花温柔,,素质真低，应该公布司机的车牌号等，不管是滴滴打车，还是其他的打车软件都永久禁止他。 
2461,2017-6-17 19:30 ,对酒当歌_我只愿开心到老,,现在滴滴怎么逃单？一次你就打不了车了。这司机要严惩 
2462,2017-6-17 19:29 ,Greatfuture惠,,吓的我想起来我我也没付有一单，赶快付了 
2463,2017-6-17 19:29 ,狂儒小小生,,警局还有这种操作？遇到假警察了吧？我建议这位警员吃口屎冷静一下再说话 
2464,2017-6-17 19:29 ,你的鞋吗,五花小肉,你做过滴滴吗？ 
2465,2017-6-17 19:28 ,contain01,,有一次我刚下飞机带着行李在北京西站出租车处排队等着打车去朋友家，大多数司机都找原因不拉，因为我的距离短挣不了几个钱，有一个司机在我上车前没问我去哪，可是快到地方却不给拉到楼下，说“如果早知道这么近就不拉我了，拉到这附近就已经不错了。”我付了钱一分不少，然后下车拖着行李走到累死 
2466,2017-6-17 19:28 ,乄厘头児,,我只能说警察真牛逼 
2467,2017-6-17 19:28 ,fangqingxiang-,,蒙蔽本宝宝也常常忘了付车费……第二次打车定好位之后 提醒还有一笔订单未付款……付款之后又得重新定位……蛮麻烦的……长了几次记性之后 就记得当时付款了……谁还能为了十几块钱不用滴滴了咋的…… ……大家都相互理解 
2468,2017-6-17 19:28 ,用户6048205360,,这样的员工，滴滴应开除。 
2469,2017-6-17 19:28 ,那年的冬天36,,恶心的人 
2470,2017-6-17 19:27 ,寒武纪的雨_g3e,,辱骂实则是违法，可以报警 
2471,2017-6-17 19:27 ,SunflowerGuardian,,很多人三观不正，哪里错了，怎么错，都不知道，把忘记说的一干二净。有时候脑子是个好东西，不是说钱的问题，是你根本不尊重别，我坐车就是没下车前微信支付了。人家赚都是辛苦钱，一群圣母婊 
2472,2017-6-17 19:26 ,十三月安,,我也经常忘付啊，但没碰到这么极品的 
2473,2017-6-17 19:26 ,张春Rain,爱诺婚纱摄影雪亭, 
2474,2017-6-17 19:26 ,callme少先队长,,这种司机碰到一次就应该打一次 时间才会和平很多 
2475,2017-6-17 19:26 ,黄山松魔法袋,,你的疏忽和碰到素质低下的司机都成问题! 
2476,2017-6-17 19:26 ,你的鞋吗,醉卧繁叶城,你做过滴滴吗？ 
2477,2017-6-17 19:25 ,疚词丶丶,丶丶惘闻, 
2478,2017-6-17 19:25 ,小芋头妈20070210,来看聪聪,你的评论才是说到点子上了！赞一个！ 
2479,2017-6-17 19:25 ,我有一个梦想_____Z,,讲真，有些滴滴师傅是真的恶心 
2480,2017-6-17 19:25 ,张春Rain,,一点素质的没有 
2481,2017-6-17 19:25 ,晓晓是凉凉,一只汪_,就服你 
2482,2017-6-17 19:25 ,蓝作死,万乘之君骑着驴,可能有好警察吧，但是我真没遇到过，有事情找他们都是冷着脸，做笔录，行了你回去吧 
2483,2017-6-17 19:25 ,走丢老人,,白养 
2484,2017-6-17 19:24 ,天边那朵云很酷,,老娘有性病，，，来啊 
2485,2017-6-17 19:24 ,你的鞋吗,卐大統領卍,你才是脑残吧 
2486,2017-6-17 19:24 ,白起家的小月寒,,我也很服气那些忘记付钱还理直气壮的人……你们是有健忘症还是怎么着，下车前顺手按两下手机就那么难吗 
2487,2017-6-17 19:23 ,马亦舒_,,这司机  欠车轮压吧 
2488,2017-6-17 19:23 ,走丢老人,万乘之君骑着驴,不干嘛，就让你白养。 
2489,2017-6-17 19:23 ,周周哩喵,Clara_崔,就比如说你老可以不用每月给你发工资，反正老板公司是实名制的跑不掉，攒个三四年再给你发也一样，又不是不发 
2490,2017-6-17 19:23 ,让点点想想,,看事情不能只看表面，也许一个巴掌拍不响呢 
2491,2017-6-17 19:23 ,别和我打招呼啊,,转发微博 
2492,2017-6-17 19:23 ,天使小布丁乖女孩,,以后女孩子一个人的情况下最好不要滴滴打车 
2493,2017-6-17 19:22 ,SnKrs_0106,欧阳小艳子,垃圾废物 
2494,2017-6-17 19:22 ,马马呼呼_,,气死了，希望女孩们都能通过正确的方式保护自己。 
2495,2017-6-17 19:22 ,吖虹虹,,我也试过忘记付钱，但是你下一次打车的时候会弹出来提醒你付的，不然就打不到车，但是这司机的素质真的太差了，别人不付就这样辱骂 
2496,2017-6-17 19:22 ,Funk雷,,河南人真TM恶心 
2497,2017-6-17 19:21 ,花颜梦无所谓,,太恶心了吧，是不是什么人都可以来开滴滴啊，滴滴公司都不进行考核的吗？ 还碰到过用滴滴叫的出租车，为了不让人用券，不经过你同意，直接点现金支付的，你说气不气😓 
2498,2017-6-17 19:21 ,你的鞋吗,隔壁-杨先生,逼点素质 
2499,2017-6-17 19:20 ,HelloMr邱,,人品问题，和职业无关 
2500,2017-6-17 19:20 ,睡不着的瓶,,司机素质差，警察不作为更正常的事，没啥🙃告他吖的就完了 
2501,2017-6-17 19:20 ,CHENDAJUN,淘专享优惠券自助搜,常常都是下次打车的时候付款的，前面几个热评证明没用过滴滴打车，把你顶上去 
2502,2017-6-17 19:20 ,你的鞋吗,欧阳小艳子,白活了你 
2503,2017-6-17 19:20 ,走丢老人,淘专享优惠券自助搜,为什么我的都是自动扣款，我没点付款直接付款了，要下车，师傅也不会说付款。到了放人就走。 
2504,2017-6-17 19:20 ,树叶大大,,不可能找不到  公道  司机太过分了  上次我下车忘了衣服手机要不时及时打电话司机都不给了  最后善良的我还是去选择了送他一面锦旗 
2505,2017-6-17 19:20 ,小哥哥-S,欧阳小艳子,没用过滴滴？ 
2506,2017-6-17 19:19 ,JulyYluj,欧阳小艳子,本来就会忘记好不好我以前也忘记过一次下了车就往学校走可我朋友说还没付钱啊 那付了钱就走还没找钱的话是什么 
2507,2017-6-17 19:19 ,HaTian48,,可以直接报警吧 
2508,2017-6-17 19:16 ,回忆愿成果,爱喝牛奶的大象,我也有一次这样的经验 
2509,2017-6-17 19:16 ,超级皮卡丘_,,以前值完班打了一辆车回家，选择了不拼坐想着快点回家睡觉，司机一路接私单（司机是调度公司的），本来一个小时能到家，花了将近三个小时，后面去滴滴投诉，想让车主还差价，滴滴表示不接受调度公司在滴滴上接单，会封掉车主但无法还我差价，代金券也没有，过两天又在滴滴上看到那个车了。 
2510,2017-6-17 19:16 ,你的鞋吗,欧阳小艳子,土狗 用过滴滴吗？ 
2511,2017-6-17 19:16 ,喵总Celia,有人喊我小星星x,你是脑子有问题还是没打过车？为了二十块故意不付钱？看来你人品就值二十了！不然怎么可能有这种恶心的想法……滴滴打车全是实名制的，不付钱以后根本都用不了的智障 
2512,2017-6-17 19:16 ,Dou子尚,,这直接就是性骚扰了好不好 
2513,2017-6-17 19:16 ,我是没有名字的美女,裸奔的小牛肉,哦你这话我还真没法怎么回你 
2514,2017-6-17 19:15 ,大蒜微信解封佣80,杨小胖啦啦啦,呃！我坐车的时候就老开着滴滴看，然后一下车马上付钱，我打滴滴时都会提前看余额够不够，不够就叫家人发过来，然后再打！不喜欢欠费 
2515,2017-6-17 19:15 ,东方红更丰富,花开花落的悲哀,现在都是免密支付 
2516,2017-6-17 19:15 ,qjf112125,,有次滴滴，手机落在了车上，司机师傅还给我送了回来 
2517,2017-6-17 19:14 ,就这样放肆生活l,安陌离Ling,中途没有超过3分钟 
2518,2017-6-17 19:14 ,我就喜欢泡菜鸭,欧阳小艳子,这次不付钱下次就打不了啊 
2519,2017-6-17 19:13 ,諸葛孔明19910720,qiuqiumm,我沒用過滴滴，但是這個層主有點智障 
2520,2017-6-17 19:13 ,十二个你_,万乘之君骑着驴,对，你们说的没错，警察就是不作为。缉毒警察以后不用出去抓毒贩了，有生命危险在家吧，消防警察也不用那么卖力救火救人了，省的救出来的是你们这群键盘侠。可悲的是人家的好你们看不见人家的不好你们全记住了，如果他知道自己善意的提醒会被大家称作是不作为的话，他一定会收回这句话。 
2521,2017-6-17 19:13 ,Mioumoon,,评论里某些人为啥就纠着女孩忘记付钱不放，难道晚两天付司机就可以性骚扰了吗？ 
2522,2017-6-17 19:13 ,就这样放肆生活l,,去年我在东莞打了一辆滴滴，也是因为下车没来得及付款，司机就打电话还说了很多过分话 
2523,2017-6-17 19:13 ,Lin因为从有到无,,呵呵这警察跟司机是统一战线吧 
2524,2017-6-17 19:12 ,国丞2011,,说忘了呢都是借口，明显是那女的嫌绕路了不想付钱，滴滴司机按导航送达没有收到相应的报酬，惹急了骂了那女的！激起了茅盾！ 
2525,2017-6-17 19:12 ,Lucky小包子,阿齐思蒋一点都不cool,不是所有的都自动付的，我的就不是，据说是之前用过优步的才会自动，所以还是看情况的 
2526,2017-6-17 19:12 ,此刻以进入梦乡,欧阳小艳子,我就是来看多少人骂你的 
2527,2017-6-17 19:12 ,我叫白小白白白,,说不付钱的人肯定是没用过滴滴的，滴滴打车这次的钱不付，下次没办法打车的。本身就是司机有问题，作为一个滴滴的资深用户，真的很担心司机的素质问题，以后打车还真是得小心 
2528,2017-6-17 19:11 ,张JY影视,,直接举报 
2529,2017-6-17 19:11 ,佛係圊年,,多少钱而已。想钱想疯了 
2530,2017-6-17 19:11 ,Scott-Zopa,,举报吧 并且警察的处理方式欠妥 
2531,2017-6-17 19:10 ,qq120101,朴觅轩,这种人玷污了素质二字 
2532,2017-6-17 19:10 ,风剑火月,,究竟睡没睡呢 
2533,2017-6-17 19:09 ,十年sailing,,有些小姐就是坐车不给钱用身体换来的，司机是老司机了 
2534,2017-6-17 19:09 ,我再也找不到你了吧,,还好我开通了免密支付 
2535,2017-6-17 19:09 ,王旭阳yangyangyang,欧阳小艳子,你该不是智能手机都没用过吧？小学生就去写作业，逛什么微博 
2536,2017-6-17 19:08 ,十年sailing,, 
2537,2017-6-17 19:08 ,你为哈占用我的名字,牵你手好吗,也许兼职是司机 
2538,2017-6-17 19:07 ,穎儿Isabella,lee_darling甯甯, 好可怕，吓得我赶紧去看下今天有没有付款我前几次都忘记付款，第二天才打车才发现，还好没有遇到这样的情况。 
2539,2017-6-17 19:07 ,覃覃覃芙蓉Qin,,我每次打车忘记给。都是下次打车才知道。为什么没人提醒我 
2540,2017-6-17 19:07 ,林馨瑶_,_王芊芊, 我要改名 
2541,2017-6-17 19:07 ,电竞崔嵘,欧阳小艳子,看见大家都骂你 我就不替你爸妈操心了 
2542,2017-6-17 19:07 ,邻家的孩子很听话,,第一次滴滴打车我问司机，我该怎么给你付钱😂司机很愉快的给我讲解 
2543,2017-6-17 19:07 ,zz智障收割机233,我不告诉你呀你猜,我就是下次叫车才给的啊，又逃不了 
2544,2017-6-17 19:06 ,你佳爷我吖,,评论里说女孩的 没用过滴滴别逼逼 
2545,2017-6-17 19:06 ,Lucky小包子,Tiger860508,忘了付车费很正常啊！我有时候一忘十天半个月的呢！自己压根不记得，等到自己要打车了才知道还有钱没付！这个又跑不了实名制的！不付钱你又不能打第二次车！这司机有病，直接告他！ 
2546,2017-6-17 19:04 ,zz智障收割机233,Tiger860508,我都是几天后才给的这有什么？ 
2547,2017-6-17 19:04 ,小昕May,,滴滴和优步很多司机都很没素质，经常司机开错路，多了几十块车费。滴滴还好，优步连个客服都找不到 
2548,2017-6-17 19:04 ,不负轮回不负君,做个坏少爷,因为丢过两次东西在车上都是找客服介入才联系上，买完单就变成空号了…司机也联系不上我 
2549,2017-6-17 19:04 ,知了_Yxz,,确实会忘，因为大多数都是自动付款，uber刚被滴滴并的时候不能用信用卡，然而我并不知道，坐完车直接走了钱也没扣，手机会有提示付款失败，想着第二天早上再弄，结果忘了，三天后司机打电话看我是不是忘了，就很尴尬 
2550,2017-6-17 19:04 ,李家有酒酒,超冧小凤凤丶, 
2551,2017-6-17 19:02 ,杨七七手心里的蠢沐,,太过分了，素质太低 
2552,2017-6-17 19:02 ,摯愛field,,滴滴打车 不是到达目的地，自动付款吗？奇怪了 
2553,2017-6-17 19:02 ,钱依依sos,,我的滴滴会自动从我微信里扣钱，现在想想应该也算是忘记付款的一个措施了吧 
2554,2017-6-17 19:01 ,zk6103,OneThinnnnnng, 
2555,2017-6-17 19:01 ,百小白白白,欧阳小艳子,你们不要骂她了。毕竟没脑子。骂也没用。我们直接打死她吧 
2556,2017-6-17 19:00 ,胡腊梅Nancy,嘿妳好吖,还是夸过 
2557,2017-6-17 19:00 ,sensencoder,,赞同 
2558,2017-6-17 19:00 ,你_无期,,滴滴怎么会呢？ 
2559,2017-6-17 19:00 ,墨迹天下1259,万乘之君骑着驴,反正我是没见过警察干活，车被偷了，去立了案就不了了事 
2560,2017-6-17 18:59 ,空城旧梦_乱了流年,欧阳小艳子,好恶毒 
2561,2017-6-17 18:59 ,胡腊梅Nancy,欧阳小艳子,你在放屁 
2562,2017-6-17 18:59 ,本领域的技术人员,老Kuma,不用，年轻点，不太丑即可，毕竟客户都是40岁往上的姐姐。 
2563,2017-6-17 18:59 ,胡腊梅Nancy,我都说了鹿晗不是我的,我也是！ 
2564,2017-6-17 18:59 ,付浩同学,,绑定花呗默不作声 
2565,2017-6-17 18:58 ,柠檬是个大天才i,,跟滴滴没什么关系好吗标题党，这完全是司机个人问题…… 
2566,2017-6-17 18:58 ,付可治,,吓得我立马返回滴滴看看是否有忘记付款 
2567,2017-6-17 18:58 ,勤奋的股骨头,,因果关系，假设，妹子没忘，司机肯定不会这样，要多面去考虑问题。有因必有果 
2568,2017-6-17 18:58 ,美甲的小桃,,我也有忘付钱的时候，隔了几天才想起来，滴滴打车一般都是下了车才付的，忘记很正常，司机可以的短信提醒一下，我就讨厌这样的无素质的人群 
2569,2017-6-17 18:57 ,jn-八戒,,奇怪滴滴司机与乘客联系的电话号码是系统随机虚拟号码…直至支付交易完成。滴滴系统号码即使公布也无用。 
2570,2017-6-17 18:57 ,Choran-,旧时光一旧时光,忘记付钱等于不给？？？你用过滴滴？？？ 
2571,2017-6-17 18:57 ,有您而幸福,,光棍儿吗？ 
2572,2017-6-17 18:57 ,Choran-,幸运风一样的啦啦啦,忘记付钱不等于不付，下次用滴滴的时候一定付了钱才能用。你没用过滴滴？ 
2573,2017-6-17 18:56 ,纯黑色耳钉的传说,,司机不应该知道乘客的手机号呀？我有事忘记当时付款，等再次叫车时，就可以把未付款结清，再叫车的。这位女孩需要的是司机诚恳的道歉，对于女孩来说，司机的行为已经对她造成伤害。 
2574,2017-6-17 18:56 ,唯一2U,万乘之君骑着驴,现在这种人思想多的是，太可怕了，上次坐车遇见一个变态，还威胁人，完了我朋友知道后还说，是不是因为穿的太清凉了啊，这都什么思想……严重三观有问题，那这样意思就是哪块被盗了啥的，还怪人家防盗措施做得不到位？也是够了 
2575,2017-6-17 18:56 ,芳二小姐,万乘之君骑着驴,就是，现在的警察很多是这样，不负责 
2576,2017-6-17 18:56 ,绿袖子997,爱新觉罗雨爷,有意思？ 
2577,2017-6-17 18:55 ,繁华落尽优梦如痕,万乘之君骑着驴,因为现在好多所谓的警察都他妈是拿钱不干事的，要来有毛用 
2578,2017-6-17 18:55 ,子鄢110,小野人C太太,戳你心窝了吧。@小野人C太太 
2579,2017-6-17 18:55 ,漂洋过海的鱼万花筒,Janice_琳1904785436,我也是还骂我，我都道歉了，还赔了2块违约金，他还是骂我 
2580,2017-6-17 18:55 ,热情佛心,,标准的下三滥 
2581,2017-6-17 18:55 ,O_o小幺姬,卐大統領卍,看到那么多人骂你我就放心了 
2582,2017-6-17 18:55 ,commander可可,,滴滴的bug很多，以前滴滴司机很在乎信用问题，现在的滴滴司机都不在乎了，对于他们来说反正也不赚钱。滴滴现在监管不严滴滴司机又得不到好处导致乘客也不爽 
2583,2017-6-17 18:54 ,ZxinG521,,不付下次不能坐车的！ 
2584,2017-6-17 18:54 ,会发光的华晨宇,,这个司机是什么人啊，还骂人家差二十快啊！住在贫困地区没有钱，你有钱你这样干嘛啊，真是有意思，警察居然说让这个女孩换手机号，你咋想的，你这样的警察也该举报你，任何人不再次使用这个软件的话不会想起来，包括我也是这样，记性不好咋啦，你这样做不觉得太过分了吗，你这样的司机还干服务行业呢！ 
2585,2017-6-17 18:53 ,丫丫3229,,经常都是再次打车的时候才会发现上次的账单没付，看来我遇见的都是好司机 
2586,2017-6-17 18:53 ,O_o小幺姬,,滴滴都是自动付款的，完全没这碴 
2587,2017-6-17 18:52 ,我们都痴爱,,又是河南新闻 
2588,2017-6-17 18:52 ,Yueyan_Hui,,这个是逃不了单的。就算没有付款，只要是你之后打开滴滴，你之前没有付款的页面还是会弹跳出来，并且不能进行再次叫车。要付款后才能进行接下来的一切叫车活动。所以这件事情折射出来的完全是这个司机的人品与素质问题。退一步说，就算不是忘记付款，也没有必要爆如此粗口 
2589,2017-6-17 18:51 ,ZLRBZZE,,我外公来我家，回去的时候叫了辆滴滴，结果来回就被坑了几百多快，就知道欺负老年人不懂，我怀疑我叫的是假的滴滴 
2590,2017-6-17 18:51 ,半夏无情_,,我经常忘了付等到下一次用滴滴才发现 
2591,2017-6-17 18:51 ,小小火柴等待爆发,万乘之君骑着驴,说的对，给你一个赞 
2592,2017-6-17 18:50 ,郁安正品美瞳代购,普通友人A,是的 
2593,2017-6-17 18:50 ,我娇哥最酷丶,万乘之君骑着驴,特别赞同这句话 
2594,2017-6-17 18:50 ,大板姐,,给他剁了，臭不要脸的 
2595,2017-6-17 18:50 ,红领巾8,,骂人不对！可是怎么就忘了付费呢？工资忘了给你开行吗？你不骂街？ 
2596,2017-6-17 18:50 ,柒之彼岸,,我经常忘记付钱，都是在下一次使用的时候看到的提醒。感谢司机师傅没打算睡我。 
2597,2017-6-17 18:50 ,吖尼呀Y,,之前打车不小心用了一个不能用于支付的支付宝（特定用途的专用支付宝），下车的时候才发现不能付款，问司机师傅怎么弄，他很淡定的说也不知道，直接就走了，给我急的，还没我担心能不能付钱。之后才知道重新下个嘀嘀软件就可以，用另一个支付宝付款了。 所以这绝对是司机的问题没毛病 
2598,2017-6-17 18:49 ,精分烧酒-咸鱼要努力冲鸭,在下名叫魏无羡,他没用过还来自作聪明怼别人啊 
2599,2017-6-17 18:49 ,红烧肉2088,,这样的司机就该清除司机队伍 
2600,2017-6-17 18:49 ,小清新加女汉子love,,今天坐滴滴，也遇到个奇葩 
2601,2017-6-17 18:49 ,郭金铭觉得李敏镐是全世界最好的,moietyO_o,@fulure 
2602,2017-6-17 18:48 ,4桔子有点酸,,我就经常忘记，每次都等要打车才看到上次的没付，感谢大哥们的不辱之恩 
2603,2017-6-17 18:48 ,红烧肉2088,,以前每回打车一到目的地就付钱的 
