8820,2016-10-16 23:37 ,你这么帅我能睡你吗,,妈的原来看成大张伟的不止我一个 
8821,2016-10-16 23:37 ,电竞课代表李翠莲,鹿屌屌,哈哈哈哈 
8822,2016-10-16 23:37 ,UMAX-T,,看成大张伟的不止我一个吧 
8823,2016-10-16 23:37 ,小王西西西,,看成大张伟的赞我 
8824,2016-10-16 23:37 ,Echowing-,,看成大张伟！ 
8825,2016-10-16 23:37 ,不要熬夜命比微博重要,,吓死我，以为大张伟 
8826,2016-10-16 23:37 ,今天娶到迪丽热巴了吗,,大张伟，真是的，我以为我哥们粗了什么事捏 
8827,2016-10-16 23:37 ,肉嘟嘟的猪小櫴,,原来不止我一个人看成大张伟 
8828,2016-10-16 23:37 ,大变可爱P,,第一眼看成了大张伟吓死宝宝了 
8829,2016-10-16 23:37 ,江姑娘与海盗,,原来我第一眼就想成了大张伟 
8830,2016-10-16 23:37 ,可乐了可乐的可乐AZlfjj,,原来大家都看成大张伟了😂 
8831,2016-10-16 23:37 ,胖墩墩的玉zai儿,,还以为是大张伟呢 
8832,2016-10-16 23:37 ,-耗子丶,登等登等灯灯, 我也以为是大张伟😂 
8833,2016-10-16 23:37 ,生活随想记,,看成大张伟了 
8834,2016-10-16 23:37 ,我不愿意种花-,,我以为大张伟怎么了。。。 
8835,2016-10-16 23:37 ,大海的颜色-ly,,看成大张伟的果然一溜溜 
8836,2016-10-16 23:37 ,哲这哲,,热门是这么上的吧，看见一位是大张伟了马上点进来！ 
8837,2016-10-16 23:36 ,老薛划船不用桨,,第一眼愣是看成大张伟 我的天！ 
8838,2016-10-16 23:36 ,木迥,蕃茄也炒蛋,😂😂我也是 
8839,2016-10-16 23:36 ,公子如玉也,,妈的 我还以为大张伟搞什么大事情了勒 
8840,2016-10-16 23:36 ,柠檬甜甜滴_,,我以为只有我看成了大张伟。。。 
8841,2016-10-16 23:36 ,黄小仙hcy,,原来好多人看成大张伟了，我不孤单😂 
8842,2016-10-16 23:36 ,我是你dage,,我不会承认我第一眼看成大张伟回国自首我以为他犯了什么罪 
8843,2016-10-16 23:36 ,i史迪仔的夏天,,咋一看以为是大张伟呢 
8844,2016-10-16 23:36 ,浪花信任云的白_,,看成了大张伟！还心思他咋还犯事儿了！ 
8845,2016-10-16 23:36 ,慵懒de小情调22,有一个大蕊, 哈哈哈，我说大张伟这是咋了哈哈哈 
8846,2016-10-16 23:36 ,清河十里,,吓死了我以为大张伟怎么了呢！ 
8847,2016-10-16 23:36 ,ZhangAnnie,,妈蛋，看成了大张伟…我还说他咋了！ 
8848,2016-10-16 23:36 ,抹茶味蜂蜜,,热门看到，以为是大张伟呢 
8849,2016-10-16 23:36 ,雷哥带我玩,_trubo菜_,我也是，吓死了 
8850,2016-10-16 23:36 ,琴瑟仙男C,,只有我看成大张伟？ 
8851,2016-10-16 23:36 ,最近不吃肉了,,吓死了，看成大张伟了，一看评论原来不仅仅是我看错了，呵呵 
8852,2016-10-16 23:36 ,WWqg123,我爱小眼睛天然呆, @费大城小事 看成大张伟，笑死了 
8853,2016-10-16 23:36 ,秋风未曾忘,Unauffindbar, 吓我一跳 
8854,2016-10-16 23:36 ,沐沐沐沐沐逸,,啊啊啊  我也看成了大张伟 
8855,2016-10-16 23:36 ,bleho,,哈哈哈哈哈哈哈哈哈哈哈哈哈哈哈哈哈哈哈哈，我也看成大张伟了。 
8856,2016-10-16 23:36 ,Soul遇,,我看的大张伟…… 
8857,2016-10-16 23:36 ,耀文不是狗,大张伟, 
8858,2016-10-16 23:36 ,不准打扰我背英语,,吓死我了，第一眼竟然看成大张伟😱😱😱 
8859,2016-10-16 23:36 ,蕃茄也炒蛋,系着鞋带子的长颈鹿,大老师真是深入人心 
8860,2016-10-16 23:36 ,小阿菲Miffy,,我以为大张伟抄袭人歌曲潜逃国外了呢 
8861,2016-10-16 23:36 ,Happy樱夏,,原谅我看成了大张伟而点进来的。。。 
8862,2016-10-16 23:36 ,qizhuquzhuangshu,,妈呀吓死我，看成大张伟 
8863,2016-10-16 23:36 ,开过光的西红柿炒鸡蛋,,不是我一个人看成大张伟，这样我就放心了 
8864,2016-10-16 23:36 ,邓飞雪不要脸红红,公羽羽公,然后我还脑补他是不是跟宋冬野一起吸毒😂😂😂然后宋冬野被抓了，他自己自首了😂😂😂 
8865,2016-10-16 23:36 ,晗晗珍可爱66,,大张伟老师 出来说句话呀😂😂 
8866,2016-10-16 23:36 ,是宁宁啊_,,原来不止我一个人看成了大张伟 
8867,2016-10-16 23:36 ,紫_斤_页,,吓死宝宝了我以为大张伟 
8868,2016-10-16 23:36 ,哈喽102188,,看成大张伟 
8869,2016-10-16 23:36 ,大饼脸柯基,,尼玛看成大张伟还以为大张伟犯事自首了懵逼半天！ 
8870,2016-10-16 23:36 ,是琳涵啊,,大老师哈哈哈哈 原来不止我一个人看成了大张伟 
8871,2016-10-16 23:36 ,hudaxianaini,,我看成了大张伟 
8872,2016-10-16 23:36 ,人性小厨娘,,我一晃神，看成了大张伟 
8873,2016-10-16 23:36 ,我是陈碗饭嘤嘤嘤,,我也以为大张伟 
8874,2016-10-16 23:36 ,景末frey,,握草热评一水儿的大张伟……该换眼睛了各位😂 
8875,2016-10-16 23:36 ,于是我便成了安,大张伟, 
8876,2016-10-16 23:36 ,想笑一直笑,,一开始看成大张伟  吓尿我 
8877,2016-10-16 23:36 ,II辣鸡,,感觉是看成大张伟才上的热搜 
8878,2016-10-16 23:36 ,Mrs_智慧佬人,,吓死我了，以为大老师出什么事了呢 
8879,2016-10-16 23:36 ,老子给你一锭子打起来,,有多少人看成了大张伟 
8880,2016-10-16 23:36 ,王枣枣吃枣枣,,应该有很多人以为是大张伟吧……我也是一个 
8881,2016-10-16 23:36 ,萌鹿哟M,,看成大张伟 
8882,2016-10-16 23:36 ,Wininininer-欣,,有多少人看成大张伟了 
8883,2016-10-16 23:36 ,怎么样都好吃,,第一眼看成大张伟 
8884,2016-10-16 23:35 ,尹然皙,,看成了大张伟 
8885,2016-10-16 23:35 ,替天行道500年吖,,哦看成了大张伟。吓死宝宝了 
8886,2016-10-16 23:35 ,高爽月,,大家都看成了大张伟我就放心了～ 
8887,2016-10-16 23:35 ,M02738,ZachMiles,抱歉，法律定义抄袭，而不是你说是就是，再来个人说不是就不是，维系社会秩序是需要公正的第三方标准的。嘻唰唰就是cx了，所以必须道歉，其他不是。您不愿意接受这个事实，我再怎么跟您科普法律和音乐也没有用，对吧？一个人只要他合法，那么取得任何成就都是应该的。#千万不要去b站搜大张伟# 
8888,2016-10-16 23:35 ,Mak米仔,,第一眼看成大张伟😂 
8889,2016-10-16 23:35 ,大大家二女子,,我在大张伟，张伟，张大伟中间纠结了很久 
8890,2016-10-16 23:35 ,HCY的歌迷MER,,看成大张伟了 
8891,2016-10-16 23:35 ,三文鱼仙女,,吓人 以为大张伟犯啥事了 
8892,2016-10-16 23:35 ,Xback雨衣,,第一眼看成大张伟不是我一个 
8893,2016-10-16 23:35 ,-PONYOAYO,懵, 
8894,2016-10-16 23:35 ,木木粉儿,,看成大老师的请点赞 
8895,2016-10-16 23:35 ,一四姨,,看成大张伟，妈的还好不是 
8896,2016-10-16 23:35 ,coco太阳呀i,,多少人和我一样第一眼看成了大张伟 
8897,2016-10-16 23:35 ,周周sakura,,第一眼看成大张伟，吓死 
8898,2016-10-16 23:35 ,阿喵咪呀,W杨杨杨杨杨杨杨, @卢yourui @TigerTigerH 我去 真看成大张伟了！ 
8899,2016-10-16 23:35 ,EK_Young,,一定不是我一个人看成大张伟 
8900,2016-10-16 23:35 ,灿烈夫人林馨,,真的看成是大张伟了 
8901,2016-10-16 23:35 ,方方方子祎,,卧槽我也看成大张伟！ 
8902,2016-10-16 23:35 ,长耳朵汪yu,,吓尿😱，看成大老师惹 
8903,2016-10-16 23:35 ,丹玲小纪,,看成大张伟以为他怎么了 
8904,2016-10-16 23:35 ,Lee酱丶,,看成了大张伟。也是醉 
8905,2016-10-16 23:35 ,爬行的蜗牛一荷,,我在想这不是那个演艺圈的人，怎么看着不像 
8906,2016-10-16 23:35 ,旧的屋檐,,我看成了大张伟 
8907,2016-10-16 23:35 ,三人行必有我徒儿,,我真的看成了大张伟我就说那么好的一个人。。。。怎么 
8908,2016-10-16 23:35 ,最爱的痘痘龙,,犯法表情还这么开心 
8909,2016-10-16 23:35 ,高爽月,,哈哈哈原来大家都看成了大张伟！ 
8910,2016-10-16 23:35 ,不知名的小狗路旁人,,我以为是大张伟我还在想大张伟前天还在天天向上采访我五月天来着呢。今天怎么被逮了 
8911,2016-10-16 23:35 ,白凤九系可爱的小服倪,,我以为大张伟…吓死我了 
8912,2016-10-16 23:35 ,Josephine_ChulHae,,看成了大张伟 
8913,2016-10-16 23:35 ,生活中的喜乐君,,我是看成大张伟才点进来的 
8914,2016-10-16 23:35 ,李旖旎sosoli,,我第一眼看成了大张伟，也是惊了 
8915,2016-10-16 23:35 ,蓓一坨,,昨天我妈还管大张伟叫张大伟，原来就有这么个人啊 
8916,2016-10-16 23:35 ,陳小傑Jenks,,哦。。。看成大张伟 
8917,2016-10-16 23:35 ,Mat_hjarnan,,我还以为是大张伟 
8918,2016-10-16 23:35 ,芥末酱子三文鱼,,看到大张伟点进来的我不是一个人 
8919,2016-10-16 23:35 ,任任任任任小不,,有多少人看成了大张伟 
8920,2016-10-16 23:35 ,王饭饭饭,,大张伟？🤓🤗 
8921,2016-10-16 23:35 ,吕三岁爱吃肉,,看成大张伟了 
8922,2016-10-16 23:35 ,烯烯_尛,,关于这个人的新闻出现几次，我就错看成大张伟几次 
8923,2016-10-16 23:35 ,木子滢l,,所以，中国的文化博大精深。。。。嗯，看成大张伟的不是我一个人 
8924,2016-10-16 23:35 ,-_-----__---------,,哈哈哈哈哈哈哈雾草我也看成大张伟哈哈哈哈哈哈 
8925,2016-10-16 23:35 ,ninoisland,,评论全在说大张伟 重点全错 虽然我也看成了大张伟 
8926,2016-10-16 23:35 ,尛尛ccci,,哈哈，果然都看成了大张伟，吓得我虎躯一震 
8927,2016-10-16 23:35 ,陈跑跑-,,看成大张伟了 
8928,2016-10-16 23:35 ,香村小喇叭,,看成了‘大张伟’吓我一跳 
8929,2016-10-16 23:35 ,李晨LiH,,卧槽，为什么看到了大张伟，吓死我了，一看评论，原来不是我一个人 
8930,2016-10-16 23:35 ,connie_zgy,,第一眼看成大张伟 
8931,2016-10-16 23:35 ,1900_0,,看来不止我一个人 
8932,2016-10-16 23:35 ,小迷亚亚亚,,看成了大张伟 
8933,2016-10-16 23:34 ,小千海淘铺,,原谅我看成大张伟 
8934,2016-10-16 23:34 ,-我啊我,,我特么看成大张伟.😂 
8935,2016-10-16 23:34 ,viky_薇薇,,真的看成大张伟 哈哈哈哈哈哈哈
8936,2016-10-16 23:34 ,弋气飞洋,,还以为是大张伟，想着有什么可自首的。。 
8937,2016-10-16 23:34 ,乐泥宝贝,,这大晚上的，吓死宝宝了大老师 
8938,2016-10-16 23:34 ,乾坤大挪移zz,,我看了第二遍还是大张伟 
8939,2016-10-16 23:34 ,翻滚的二爷粉,,我特么看成了大张伟 
8940,2016-10-16 23:34 ,Sift和尘,,看成大张伟的路过 
8941,2016-10-16 23:34 ,南墙北绕,,看成大张伟的请自觉面壁…我去面壁啦再见 
8942,2016-10-16 23:34 ,你是年少的欢喜啊oO,,吓死我，我还以为是大张伟 
8943,2016-10-16 23:34 ,太阳底下织毛衣,,大张伟 
8944,2016-10-16 23:34 ,懒LL癌,,一一眼看成大张伟。。。吓死 
8945,2016-10-16 23:34 ,Su蔓汐,,对不起，看成大张伟了 
8946,2016-10-16 23:34 ,枯荣有数啊,,表示看成大张伟 
8947,2016-10-16 23:34 ,太阳女神苏小啦是也,,在那想半天，大张伟叫什么名字？ 
8948,2016-10-16 23:34 ,萧瑟00197,,U湄公河行动各种免费资源！✨ 想要的私我✨ 免费无偿秒发 
8949,2016-10-16 23:34 ,因为Anton是大侠呀,,看成大张伟的绝对不止我一个！ 
8950,2016-10-16 23:34 ,魔力的建筑,,第一眼看成大张伟 
8951,2016-10-16 23:34 ,小鳗鱼儿_92207,曾经是第一名,你不是一个人！ 
8952,2016-10-16 23:34 ,西祠悠然,,以为大张伟 
8953,2016-10-16 23:34 ,木子滢l,,我一眼看成了大张伟，我想知道这不是我一个人 
8954,2016-10-16 23:34 ,NANA_Misytic,,原谅我不小心看成了大老师🙄 
8955,2016-10-16 23:34 ,八组娱乐说,//,@凝聚力China张大伟大张伟张伟大大伟张伟大张，哎哟，吓死奶奶了 
8956,2016-10-16 23:34 ,陈昭颖--,徐明Genius,所以这是谁 
8957,2016-10-16 23:34 ,公羽羽公,邓飞飞飞飞飞飞雪,我也是 
8958,2016-10-16 23:34 ,这个人丶是光,,大张伟怎么了？犯了什么罪？ 
8959,2016-10-16 23:34 ,这只鹿有点萌,,原谅我第一眼看成了大张伟 
8960,2016-10-16 23:34 ,你说要和我一起慢慢走,,都看成了大张伟，我也是哈哈 
8961,2016-10-16 23:34 ,宇宙最强少女时代kun,,妈的，以为大张伟 
8962,2016-10-16 23:34 ,與肉,,看成大张伟 
8963,2016-10-16 23:34 ,婳坞伊人,3w和com,一样 
8964,2016-10-16 23:34 ,真的萌死小馬了-,,我也看成大张伟了 
8965,2016-10-16 23:34 ,话山鬼,,我还以为大张伟 
8966,2016-10-16 23:34 ,Dora_邓萍呀呀呀,,尼玛，看成大张伟回国自首 
8967,2016-10-16 23:33 ,Wosasa_,,这名字是要搞事情啊！我看成了大张伟，还以为发生了什么吓死我 
8968,2016-10-16 23:33 ,呆呆Girl的温暖Boy,,我也以为大张伟 吓我一跳 
8969,2016-10-16 23:33 ,思达WSD,,好像所有人都看成大张伟了 
8970,2016-10-16 23:33 ,是加七啊喂,,我以为大张伟……吓一跳😂😂 
8971,2016-10-16 23:33 ,郭周阳,,卧槽...看成大张伟了 
8972,2016-10-16 23:33 ,一个厉害的西柚,,第一眼看成大张伟的原来不是我一个人😂 
8973,2016-10-16 23:33 ,荔枝不怕怕怕,,我在想大张伟犯什么事了 
8974,2016-10-16 23:33 ,江春入旧年suan,,我以为大张伟 
8975,2016-10-16 23:33 ,-壹玖玐玐,,对不起大老师 
8976,2016-10-16 23:33 ,喜欢Soraka,,吓一跳 以为大张伟→_→ 
8977,2016-10-16 23:33 ,电话那头有个妖怪,,大张伟 
8978,2016-10-16 23:33 ,_大脸小姐_,,吓死我了 我以为大张伟 
8979,2016-10-16 23:33 ,可爱的魏大胖,,总把他读成大张伟 
8980,2016-10-16 23:33 ,时间也抹杀不了的颜值,,尼玛我以为是大张伟 
8981,2016-10-16 23:33 ,无敌臭脸王,Leee_Xin, 
8982,2016-10-16 23:33 ,你眼里的海是巴萨的蓝,,吓死宝宝了 
8983,2016-10-16 23:33 ,livelyleelee,,看成大张伟了，不好意思 
8984,2016-10-16 23:33 ,撩咸高手,,看成大张伟的不止我 
8985,2016-10-16 23:33 ,美国经典原味乐事,,我还以为大张伟 
8986,2016-10-16 23:33 ,失眠少女CC茜,大张伟, 
8987,2016-10-16 23:33 ,螃小蟹音符,,我看成了大张伟 
8988,2016-10-16 23:33 ,偉Z-H-羣en,,看成大张伟🙄 
8989,2016-10-16 23:33 ,拈花大妹子,,看成大张伟点进来的点个赞…😂 😂 
8990,2016-10-16 23:33 ,平凡的玛格丽特,,哈哈哈，以为大张伟 
8991,2016-10-16 23:33 ,abcdefghijklmnopqrstuvwxyx,大张伟花儿, 
8992,2016-10-16 23:33 ,蝶梦庄周vv,,看成大张伟了 
8993,2016-10-16 23:33 ,三只的迷姐,,告诉我第一眼看成大张伟的不是我一个😂 
8994,2016-10-16 23:33 ,丁九七,,大张伟。。不好意思我眼瞎 
8995,2016-10-16 23:33 ,正三观,,看成大张伟的抱紧我 
8996,2016-10-16 23:33 ,夭夭夭小離丶,,看成大张伟！！！就我吗？？？ 
8997,2016-10-16 23:33 ,19必能上社科,,看半天都以为是大张伟… 
8998,2016-10-16 23:33 ,一颗很懒的糖,,讲真一直看成大张伟……ʅ(⊙ω⊙)ʃ…… 
8999,2016-10-16 23:33 ,白茶羽化,,哈哈哈，我不是一个人，看成了大张伟 
9000,2016-10-16 23:33 ,UKY_Me,,第一眼看成大张伟……蠢哭 
9001,2016-10-16 23:33 ,禾必禾必禾必呢,,我以为就我看成了大张伟一开评论原来全是大张伟 
9002,2016-10-16 23:33 ,尼莫_____,,我特么看成了 大张伟...... 
9003,2016-10-16 23:33 ,你你你也可以是,,我以为大张伟呢 
9004,2016-10-16 23:33 ,Xstar1993,,看着大张伟了 
9005,2016-10-16 23:33 ,Daisy菊巨,,看成了大张伟可还行 
9006,2016-10-16 23:33 ,一口钵呀,,哎呀眼花看成大张伟了，还以为他咋回事儿了呢 
9007,2016-10-16 23:33 ,JUNMCCC,,我TM硬生生的看成了大张伟！！！ 
9008,2016-10-16 23:33 ,Flora_HCY,,不好意思，我看成大张伟了 
9009,2016-10-16 23:33 ,Wuhui_妘,,都看成了大张伟 
9010,2016-10-16 23:32 ,HIKH-李,,妈的，我以为大张伟 
9011,2016-10-16 23:32 ,凉面女王,,我默默地把说看成大张伟的评论都赞了一遍，因为我也是！😅 
9012,2016-10-16 23:32 ,国胖的脑残粉,,看成大老师😂 
9013,2016-10-16 23:32 ,曾经也是瓜子脸,,事实证明文字序顺并会不响影阅读 
9014,2016-10-16 23:32 ,鼓楼大结巴,,我还说大张伟什么时候出国了？ 
9015,2016-10-16 23:32 ,-对象,,看了评论才知道是张大伟 
9016,2016-10-16 23:32 ,--张Xiao,,我把张大伟和大张伟混为一体了😂 
9017,2016-10-16 23:32 ,呐兹咩喵,,看成大张伟 
9018,2016-10-16 23:32 ,-小雯雯wj,,还以为大张伟呢 
9019,2016-10-16 23:32 ,一颗糖丸子,,我看成了大张伟 
9020,2016-10-16 23:32 ,就是王大囡,,麻痹，大张伟 
9021,2016-10-16 23:32 ,L橙子树下的橙子Y,,看来不是只有我一个人看成了大张伟 
9022,2016-10-16 23:32 ,遇见择生,,我还以为是大张伟，我在想他怎么了，回国自首，肯定不止我一个人看成大张伟对不对 
9023,2016-10-16 23:32 ,一只小菠萝_,,我以为就我一个看成大张伟的。看了评论我就放心了 
9024,2016-10-16 23:32 ,枏觅-别来无恙,,吓死我  以为大张伟 
9025,2016-10-16 23:32 ,拾柒嘎哈呀,,果然不是我一个人看成大张伟了 
9026,2016-10-16 23:32 ,你手中握着格桑花,,我看成了大张伟  
9027,2016-10-16 23:32 ,放屁嘣你a,,看评论，原来有那么多人看错 
9028,2016-10-16 23:32 ,旅座你就从了我吧,,看成大张伟了 
9029,2016-10-16 23:32 ,竹取君麻吕,,大张伟 看错了 2333 
9030,2016-10-16 23:32 ,YGJZ__DM,雷Y-M, @马鸽鸽H 看成了大张伟 
9031,2016-10-16 23:32 ,你叫桃桃,,第一反应大张伟，吓了一跳，什么鬼 
9032,2016-10-16 23:32 ,我叫甜甜就是想甜到你,,看成了大张伟。吓死了。 
9033,2016-10-16 23:32 ,Yi---Bao,,不小心看成大张伟结果点了进来 
9034,2016-10-16 23:32 ,永远的天石,,我也是看成了大张伟，看来不止我一人… 
9035,2016-10-16 23:32 ,谭三岁W,,第一眼看成大张伟  吓一跳 
9036,2016-10-16 23:32 ,Tom不是只喵,,我可以说看成大张伟了吗 
9037,2016-10-16 23:32 ,良木栖_寒,biubibiubiubi,我也…… 
9038,2016-10-16 23:32 ,丶Comedown,,第一眼看成大张伟 
9039,2016-10-16 23:32 ,Dora_zk,,一眼看成大张伟 
9040,2016-10-16 23:32 ,昕昕知昕,,吓我一跳，以为大张伟 
9041,2016-10-16 23:32 ,Leee_Xin,夏夜里的橘子汽水,张氏富二代の必经之路 
9042,2016-10-16 23:32 ,小北喔,,我以为是大张伟！！！！大张伟！！？？'吓我一跳！！ 
9043,2016-10-16 23:32 ,露露真的很严格,,以为是大张伟 
9044,2016-10-16 23:32 ,无题的一片草原,,我觉得大部分人都看成了大张伟 
9045,2016-10-16 23:32 ,黑面包酱,,我看成了大张伟 
9046,2016-10-16 23:32 ,卖白菜的小豆芽,,哈哈，大张伟汉字博大精深 
9047,2016-10-16 23:32 ,嘛辣Celine,,吓死，看了半天都以为是大张伟 
9048,2016-10-16 23:32 ,William神祗KING,,不管什么伟，反正我叫张伟，全国和我重名的50多万。悲催 
9049,2016-10-16 23:32 ,Li-2,,哈哈哈 我也看成了大张伟 
9050,2016-10-16 23:32 ,我是一朵小红花花花,,原来它之所以上热搜是因为大张伟 
9051,2016-10-16 23:32 ,_polkmn,,以为大张伟😂 
9052,2016-10-16 23:32 ,音乐料,,大张伟这个锅我不背。 
9053,2016-10-16 23:32 ,自带眉毛的懒癌患者,,一不小心看成大张伟 
9054,2016-10-16 23:32 ,耳今L,,我以为只有我自己看成了大张伟，看到评论我就放心了 
9055,2016-10-16 23:32 ,牛了一个逼,,MD 看成大张伟了 还给我整得一愣一愣的 楞是把整条新闻看完后也没发现如果不是看评论我就真以为是大张伟了呢 
9056,2016-10-16 23:32 ,希望華華吃饱睡饱玩饱HCYu,,我是看成大张伟才进来的 
9057,2016-10-16 23:32 ,无游无绿,,妈呀，看成大张伟 
9058,2016-10-16 23:32 ,方晴509,,看成大张伟进来的举手 
9059,2016-10-16 23:32 ,你好小鹿先森,,第一眼看成大张伟 
9060,2016-10-16 23:32 ,差一点肆个贰的柒姐,,看到不是只有我一个人看成大张伟我就放心了😊 
9061,2016-10-16 23:31 ,大拌菜就是蔬菜沙拉,,看成大张伟的不止我一个 
9062,2016-10-16 23:31 ,异源八倍体小黑麦,,看成大张伟了.... 
9063,2016-10-16 23:31 ,挠头使我快乐,,我以为是大张伟 
9064,2016-10-16 23:31 ,野生粥粥,,妈的 看成了大张伟...手抖戳进来了 
9065,2016-10-16 23:31 ,鬼怪家的新娘,,以为是大张伟！！ 
9066,2016-10-16 23:31 ,黄涟漪洁,蕃茄也炒蛋,看成大张伟了 
9067,2016-10-16 23:31 ,骑麻雀的蜗牛,,有跟我一样第一眼看成大张伟吗？ 
9068,2016-10-16 23:31 ,燕绥230,,大张伟 
9069,2016-10-16 23:31 ,大大加菲不吃鱼,,大张伟表示这个锅，并不背 
9070,2016-10-16 23:31 ,去年的年夜饭,#鹿晗粉丝社会毒瘤#, 
9071,2016-10-16 23:31 ,我凯i-,,一直以为是大张伟，把我吓一跳 
9072,2016-10-16 23:31 ,昨非1216,,还以为大张伟 
9073,2016-10-16 23:31 ,AI你不lay,,原来不止我第一眼看成大张伟了 
9074,2016-10-16 23:31 ,不要管馨予姐姐叫姐姐o_O,,看成大张伟的不只我一个吧 
9075,2016-10-16 23:31 ,青涩的orange,,果然都以为是大张伟了，哈哈哈，我也是 
9076,2016-10-16 23:31 ,Mayllc,张国伟_国家伟大, 吓死我了 
9077,2016-10-16 23:31 ,夏-冰,,我确定不止我一个第一眼看成了大张伟！ 
9078,2016-10-16 23:31 ,唯爱卿夏夏,,我还以为是大张伟 
9079,2016-10-16 23:31 ,zy只是一只猫,,我也以为是大张伟，还以为他犯罪了呢… 
9080,2016-10-16 23:31 ,愿汝喜,,看成大张伟了 吓我一跳 我段子手 
9081,2016-10-16 23:31 ,-李東源,,大张伟 
9082,2016-10-16 23:31 ,ChXiTi,,看成大张伟 
9083,2016-10-16 23:31 ,贝克街的彭婆婆,,我第一眼看成了大张伟 
9084,2016-10-16 23:31 ,知了cs神,,我以为是大张伟 
9085,2016-10-16 23:31 ,短尾巴兔酱Cathy,,我以为是大张伟 
9086,2016-10-16 23:31 ,来日可期12399,,还以为大张伟咋 
9087,2016-10-16 23:31 ,賣女孩的小火柴_DL,,有多少人看成大张伟 
9088,2016-10-16 23:31 ,海岛古城温暖的光,,看成了大张伟的小可爱点个赞，楼主就是因为才点进去的 
9089,2016-10-16 23:31 ,你不认识的邢小凡,,原来不是我一个人看成大张伟的 
9090,2016-10-16 23:31 ,刘刘鑫,,以为是大张伟才点进来的 
9091,2016-10-16 23:31 ,太阳味道的芒果,,可能大家都以为是大张伟，所以才上的热搜吧 
9092,2016-10-16 23:31 ,lorrita-H,,大张伟！！！我还以为他真名张大伟 
9093,2016-10-16 23:31 ,卢善良_,,我去。。吓了一跳。。以为大张伟 
9094,2016-10-16 23:31 ,WSQ是小星星,,每次看都看成大张伟 
9095,2016-10-16 23:31 ,嘻_嘻嘻哈,,我还以为是大张伟…… 
9096,2016-10-16 23:31 ,憨憨二巡票狗芦苇手下留情7,,我特么以为大张伟，卧槽还想这娃又干啥了。 
9097,2016-10-16 23:31 ,倾听夏末xia,,呵呵、还以为是大张伟 
9098,2016-10-16 23:31 ,繁往,,看成了大张伟 
9099,2016-10-16 23:31 ,懵了刺猬,,妈的智障吓死我了  看成大张伟 
9100,2016-10-16 23:31 ,秀秀爽宝i,,吓屎宝宝了 第一眼以为大张伟 
9101,2016-10-16 23:31 ,一粒白糖配红糖,爱做梦的Micro,你不是一个人 
9102,2016-10-16 23:31 ,_多肉肉的小宝贝_,,我以为是大张伟呢～ 
9103,2016-10-16 23:31 ,王子822,,看成大张伟了。。 
9104,2016-10-16 23:31 ,7vEn琪琪,,妈的，还以为大张伟， 
9105,2016-10-16 23:31 ,i张瑾,辉挥发会发挥, 
9106,2016-10-16 23:31 ,胖头鱼王,,直到点开评论才能明白 
9107,2016-10-16 23:31 ,hummmmmmSMALL,,我的天哦 看成大张伟 
9108,2016-10-16 23:31 ,闲鱼阿三,,我真的以为是大张伟。。。 
9109,2016-10-16 23:31 ,根号5肉肉儿,,马丹！我特么看成大张伟…
9110,2016-10-16 23:30 ,九月十九日,,都以为是大张伟… 
9111,2016-10-16 23:30 ,欧海中,,妈呀还以为大张伟 
9112,2016-10-16 23:30 ,美丽狐手表专卖旗舰店,,我也是看成大张伟了 
9113,2016-10-16 23:30 ,智喵的喵捷,,看成了大張偉。。。 
9114,2016-10-16 23:30 ,三三木-,,看成了大张伟 
9115,2016-10-16 23:30 ,江停停停停停停停,,原来都看成大张伟了  我看了好几遍才发现错了 
9116,2016-10-16 23:30 ,_陈致冰,,看了评论才知道原来不是大张伟 
9117,2016-10-16 23:30 ,陈夫人啊_,大张伟, 
9118,2016-10-16 23:30 ,白橙O_O,,哈哈哈一眼看成大张伟 
9119,2016-10-16 23:30 ,老子踏马就不开会员,,有谁和我一样第一眼看成了大张伟 
9120,2016-10-16 23:30 ,Lkunkk,,我也看成了大张伟 
9121,2016-10-16 23:30 ,西北吃面狂魔,,大张伟张大伟傻傻分不清楚 
9122,2016-10-16 23:30 ,澄皮陈,大老师呀大老师, 
9123,2016-10-16 23:30 ,vivianics,,求张大伟心里的阴影面积，不是只有我看成了大张伟吧😂😂 
9124,2016-10-16 23:30 ,小雨林--926,,我也看成大张伟了 
9125,2016-10-16 23:30 ,Naniga丶Zoldyck,,看成大张伟 
9126,2016-10-16 23:30 ,请叫我梁大人人人人人,,大张伟干哈了 
9127,2016-10-16 23:30 ,Derek徐先生,,看成大张伟的点个赞 
9128,2016-10-16 23:30 ,西瓜小姐Emily,,我以为大张伟吸毒了呢 
9129,2016-10-16 23:30 ,纯真的啦啦啦啦啦_2014,,原谅我看成了大张伟 
9130,2016-10-16 23:30 ,忈女,,真以为大张伟 
9131,2016-10-16 23:30 ,矮油小哥_Slon,,第一眼看成大张伟的赞 
9132,2016-10-16 23:30 ,请干了这碗毒鸡汤,,以为是大张伟，吓一跳 
9133,2016-10-16 23:30 ,lovepanpanda,,一眼看成大张伟😅又以为张国伟，看了评论我不是一个人 
9134,2016-10-16 23:30 ,林曼和鱼,,知道看到评论区我才发现我看错了 
9135,2016-10-16 23:30 ,Scarlet麦子,,吓得我以为是大大张伟 
9136,2016-10-16 23:30 ,BiuBiu-lu,,晃眼看成大张伟 
9137,2016-10-16 23:30 ,偲哥的小老婆,RosieYuki, 看成了大张伟 
9138,2016-10-16 23:30 ,李敏镐的迷糊粉,,我大老师，懵了 
9139,2016-10-16 23:30 ,注定是客,,我看成大张伟 
9140,2016-10-16 23:30 ,爱生活爱我旭旭,,看了评论 眼睛不好使的不止我一个 
