13027,2016-10-16 22:20 ,djdjdosnsn,,大张伟... 
13028,2016-10-16 22:20 ,清清清清清清波,杨晓晓晓晓晓宇, 
13029,2016-10-16 22:20 ,一个自带优越和傲娇的猪,,热门全是大张伟，没别的 
13030,2016-10-16 22:20 ,Miss-莲花,,大张伟回国自首？？？是假唱被抓了么？ 
13031,2016-10-16 22:20 ,江户川小柯,,看成了大张伟😂😂😂😂 
13032,2016-10-16 22:20 ,beloved_JYH,,我以为大张伟犯了什么事 
13033,2016-10-16 22:20 ,你丈母娘做饭真的超好吃,,我还以为大老师干啥坏事了，吓得我赶紧戳了进来 
13034,2016-10-16 22:20 ,小龙猫君i,夏花里的深绿木V, 
13035,2016-10-16 22:20 ,Cher圣雪蜜尔,,我看成大张伟了 
13036,2016-10-16 22:20 ,邓邓爸,,看成大张伟了，吓死我了 
13037,2016-10-16 22:20 ,曲生又帅了,,【张大伟回国投案自首】 啥玩意儿大张伟犯了什么罪？！ 告诉我不止我一个人 
13038,2016-10-16 22:20 ,清尘梵修,,我擦，以为是大张伟，吓一跳 
13039,2016-10-16 22:20 ,前男友的已接来电,,我看成了大张伟😳 😳 😳 
13040,2016-10-16 22:20 ,罗雅熙_熙熙,,我以为是大张伟，这乌龙，吓死人哟！！ 
13041,2016-10-16 22:20 ,芭蕾裙下的黑色裤衩子,,我看成大张伟了 
13042,2016-10-16 22:20 ,温暖至此_charmmao,,有多少人是因为 大张伟进来的？ 
13043,2016-10-16 22:20 ,我愛你已成為過去,,真的第一眼看成大张伟！以为出啥事了 
13044,2016-10-16 22:20 ,比巴卜的嘎嘣脆,,我以为大张伟………… 
13045,2016-10-16 22:20 ,花丝-Girls,,看成大张伟了😂我是一个人吗 
13046,2016-10-16 22:20 ,W麻辣小虾米,,看成了大张伟 
13047,2016-10-16 22:20 ,旧人如井,,看成大张伟，吓了一跳 
13048,2016-10-16 22:20 ,ajgtuotjnxakg,,看成大张伟了 
13049,2016-10-16 22:20 ,00-0000,,看成大张伟 
13050,2016-10-16 22:20 ,一团你的小宝宝,,我真的以为就我一个傻子看成了大张伟 
13051,2016-10-16 22:20 ,FanFanUltraman,,我他妈看成大张伟了 
13052,2016-10-16 22:20 ,强势出逃,,还特么以为是大张伟！！！ 
13053,2016-10-16 22:20 ,吃肉不想长肉,,张国伟。。大张伟 
13054,2016-10-16 22:20 ,1128的轻松熊kuma,,我居然看成了大张伟！ 
13055,2016-10-16 22:20 ,楊-fengzi,,好的 原来不是大张伟 
13056,2016-10-16 22:20 ,仙女扛霸子nymph,,你们有多少人跟我一样看成了大张伟[泪流满面] 
13057,2016-10-16 22:20 ,陈中荧-Czy,,告诉我 都有谁跟我一样看成了大张伟 
13058,2016-10-16 22:20 ,Childen啾噔, ,¡评论配图 
13059,2016-10-16 22:20 ,JYAphrodite,,我以为大张伟… 
13060,2016-10-16 22:20 ,左岸o_O右岸,,我怎么看成大张伟 
13061,2016-10-16 22:20 ,jnwhz京慧,,都看成了大张伟 
13062,2016-10-16 22:20 ,i大梦吖,,看成大张伟的🙋🏻 
13063,2016-10-16 22:20 ,卡飞rine,lovebook羚,我也以为😂😂😂😂 
13064,2016-10-16 22:20 ,唧唧复居居,,能不能正视一下这个贪官张大伟啊，好不容易上个热搜都被大张伟抢去了😂 
13065,2016-10-16 22:19 ,一起从校服到婚纱,,晕，还以为是大张伟干嘛了 
13066,2016-10-16 22:19 ,木子是个啥,,尼玛看成大张伟 中国文化博大精深…… 
13067,2016-10-16 22:19 ,韦胖妮,,妈的以为是大张伟 
13068,2016-10-16 22:19 ,成为更好的自己qll,没有卤的卤鸡蛋,我也是 
13069,2016-10-16 22:19 ,AHaelk_,,我把看成大张伟的都赞了一遍 
13070,2016-10-16 22:19 ,CCCC嗨嗨嗨,,我还以为是大张伟 
13071,2016-10-16 22:19 ,每朵云都会下落不明,,看成大张伟 
13072,2016-10-16 22:19 ,Belieber茉莉,,我还想，大张伟犯啥罪了？要不要薛之谦宝宝救他😂😂😂😂 
13073,2016-10-16 22:19 ,喜欢灼灼桃花香的少年神君是你么,,评论全是大张伟😂 
13074,2016-10-16 22:19 ,W-xxcxx,,我也看成大张伟了😂😂😂 
13075,2016-10-16 22:19 ,653楼路口_356,,我居然看成大张伟了，，，，，我也是没谁了 
13076,2016-10-16 22:19 ,坤儿的小迷妹love,#大张伟#, 
13077,2016-10-16 22:19 ,权拽跟_D,,我敢说90%的人第一眼都看成大张伟了 
13078,2016-10-16 22:19 ,那是你的那些东南西北,,我看成大张伟。哈哈 
13079,2016-10-16 22:19 ,取个什么好_,,原来不止我一人看成了大张伟😂 
13080,2016-10-16 22:19 ,韩闪闪-,,吓瑟瑟！ 
13081,2016-10-16 22:19 ,QueenDoraemon,,我以为大张伟 
13082,2016-10-16 22:19 ,敏儿的722,,看成大张伟 
13083,2016-10-16 22:19 ,独揽红尘清欢,,以为大张伟😂😂😂 
13084,2016-10-16 22:19 ,疯葱满园,,看成大张伟 
13085,2016-10-16 22:19 ,呀我是郎咩咩的我啊,,大张伟，是我瞎 
13086,2016-10-16 22:19 ,柒哎i,,吓我一跳，以为大张伟 
13087,2016-10-16 22:19 ,陈常心C,,看到大家都看错了我也就放心了嘻嘻嘻。 
13088,2016-10-16 22:19 ,静听伶夜,,看成大张伟了 
13089,2016-10-16 22:19 ,judanna-,,有多少看成大张伟 
13090,2016-10-16 22:19 ,66小拉事事,,看成大张伟了 
13091,2016-10-16 22:19 ,蘑菇小姐的幸福宣言,,哎呦我去！看成大张伟了！看评论后才发现是张大伟…… 
13092,2016-10-16 22:19 ,1ittle_5wam,,原谅我看成了大张伟 一脸蒙蔽🌚😂 
13093,2016-10-16 22:19 ,望瞳啊,,玛德我还以为是大张伟 
13094,2016-10-16 22:19 ,菲得瘦不可,,凑，以为是大张伟才点开看的 
13095,2016-10-16 22:19 ,So丶康康,,恩，不止我一人 
13096,2016-10-16 22:19 ,青93争,,大张伟 
13097,2016-10-16 22:19 ,全微博最努力的小仙女,, 那么努力就是为了可以过自己想要的生活翻翻我的微博 也许对你有用 
13098,2016-10-16 22:19 ,Tiamo_UHstring,,有多少是看成大 张 伟的 
13099,2016-10-16 22:19 ,五点一横X,,我还以为大张伟呐 
13100,2016-10-16 22:19 ,花十五就为改个名,,大张伟这是杀人了么，还自首……然后……张大伟……这特么谁啊 
13101,2016-10-16 22:19 ,知秋forget,,中国文字博大精深 
13102,2016-10-16 22:19 ,房梁上的狗,,吓一跳 
13103,2016-10-16 22:19 ,南烛几许,,吓死我了，以为大张伟怎么了呢 
13104,2016-10-16 22:19 ,小王菇凉321,,我还问家人说大张伟出事了你知道么？好丢脸！ 
13105,2016-10-16 22:19 ,柳絮飞扬720,,全都看成大张伟了 
13106,2016-10-16 22:19 ,3w和com,琴子-妃拉惊鸿,哈哈😂 
13107,2016-10-16 22:19 ,oh晓风残月,,大张伟。。。。 
13108,2016-10-16 22:19 ,宝宝竹最帅,,把所有看成大张伟的朋友攒了一遍 
13109,2016-10-16 22:19 ,芝麻开挂,,看成大张伟了 
13110,2016-10-16 22:19 ,carrie是个任性的菇凉,,我特么的第一次看个新闻评论里点赞点的手抽筋 原来大家都跟我一样看成了大张伟 
13111,2016-10-16 22:19 ,瑶沐紫,,刷博   刚看见这个新闻    一看大张伟   在看评论我不纠结我微微近视的眼睛了 
13112,2016-10-16 22:19 ,北岄_,,大张伟回国自首 一样看错的赞我 
13113,2016-10-16 22:19 ,木木木木穆呀穆,,我以为大大犯了什么事，吓死 
13114,2016-10-16 22:19 ,菠蘿罐飯H,,卧槽，吓一跳以为大张伟 
13115,2016-10-16 22:19 ,樱祭雪诺,,看成了大张伟，赶紧点进来 
13116,2016-10-16 22:19 ,梅妹妹的2018微博i,,看成大张伟，告诉我我不是一个人 
13117,2016-10-16 22:19 ,蜜果儿和梨,,看成大张伟 
13118,2016-10-16 22:19 ,灼灼祁焰,,看成大张伟@大张伟
13119,2016-10-16 22:19 ,非洲帝皇,,看成大张伟。赞我 
13120,2016-10-16 22:19 ,唐山红娘,,我还以为是大老师，所以点进来看了看 
13121,2016-10-16 22:19 ,雾以泪聚233,,原来不止我一个看成大张伟点进来的.... 
13122,2016-10-16 22:19 ,向哥哥的小天使,,我看成大张伟 
13123,2016-10-16 22:18 ,LaN5_,,😂😂😂看成大张伟回国投案自首 
13124,2016-10-16 22:18 ,miss周西西,,绝对大多数都看成大张伟了 
13125,2016-10-16 22:18 ,武是個大盗賊,,吓死我了 还以为大张伟 
13126,2016-10-16 22:18 ,薄荷樟脑丸子,,我他妈以为大张伟 
13127,2016-10-16 22:18 ,hjhemily,,幸好不是我一人看成大张伟了 
13128,2016-10-16 22:18 ,silver翕麓魃,辛普森和_楊酱, 我眼神不好 
13129,2016-10-16 22:18 ,郭海楠00,,以为是大张伟 
13130,2016-10-16 22:18 ,菇凉别假装文艺,,还以为大张伟，吓尿 
13131,2016-10-16 22:18 ,我是文化人给力姐,,特么看成大张伟才点进来的😂😂😂 
13132,2016-10-16 22:18 ,-Cingyan,,吓一跳 还以为说大张伟 
13133,2016-10-16 22:18 ,Eternal_ocean,,我还以为是大张伟，别赞要脸 
13134,2016-10-16 22:18 ,CAzxcv,,我还以为是大张伟，吓到，哈哈 
13135,2016-10-16 22:18 ,原来是小糖ya_,,妈的，吓死我了，我还以为是我大老师，吓得我不要不要的 
13136,2016-10-16 22:18 ,一个自带优越和傲娇的猪,,看成大张伟的抱紧我 
13137,2016-10-16 22:18 ,橘子味的气泡水keai,,第一眼看成大张伟⋯⋯ 
13138,2016-10-16 22:18 ,你需要治脚气,,我也看成大张伟 
13139,2016-10-16 22:18 ,羊咩咩--咩咩羊,,我还以为大张伟老师怎么了吓我一跳 
13140,2016-10-16 22:18 ,淋雨鹅,,哦 我以为是大张伟 
13141,2016-10-16 22:18 ,Ghita-hhh,,要不是都看成大张伟了 估计也上不了热搜 
13142,2016-10-16 22:18 ,五行缺钱缺爱豆,,大张伟加1 
13143,2016-10-16 22:18 ,卡卡西May,,老子真的以为是大张伟 
13144,2016-10-16 22:18 ,夏天小姐姐summer,,第一眼果断看成大张伟😂😂😂😂 
13145,2016-10-16 22:18 ,我们的明天5656,,乍一看，以为是大老师 
13146,2016-10-16 22:18 ,方块的果冻,,搞事情我以为是大张伟老半天都以为是他 
13147,2016-10-16 22:18 ,美人摘花,,原来看成大张伟的不只是我一个 
13148,2016-10-16 22:18 ,-Mininin,,看成了大张伟 
13149,2016-10-16 22:18 ,Van1的猫小姐,,去，看成 大张伟了 
13150,2016-10-16 22:18 ,圆圆黄圆圆_,,看成大张伟的路过 
13151,2016-10-16 22:18 ,肥宅gO,,都以为是大张伟他才顶热搜这么高的吧 
13152,2016-10-16 22:18 ,l李香兰ll,,我看了两遍大张伟没毛病啊 
13153,2016-10-16 22:18 ,心不在Y,,估计有80%以上看成大张伟 
13154,2016-10-16 22:18 ,ida彩虹瀑布,,看成大张伟 
13155,2016-10-16 22:18 ,污妖王小天使,,我就说嘛大张伟自什么首。。。。。 
13156,2016-10-16 22:18 ,Jing纯呐,,咋一看以为是大张伟 
13157,2016-10-16 22:18 ,黄黄大大大妹x,,第一眼看成大张伟了 
13158,2016-10-16 22:18 ,一根有故事的面,，和我一样的举手, 
13159,2016-10-16 22:18 ,你吃饱了呐_,,看成大张伟的我一脸蒙蔽的点了进来 
13160,2016-10-16 22:18 ,LIANHONGYA,,我以为大张伟…吓死我了 
13161,2016-10-16 22:18 ,卖鲜花的老阿姨,,我第一眼看成大张伟 赞我的告诉我不是一个人😭😭😭 
13162,2016-10-16 22:18 ,leesun_xu宣萱,,我是冲着大张伟点进来的，看来我不是一个人 
13163,2016-10-16 22:18 ,核桃阿麻,,吓死人了，看成了大张伟…… 
13164,2016-10-16 22:18 ,LN思南栀,,我还以为是大张伟，想着他竟然犯事了 
13165,2016-10-16 22:18 ,陌路-下一站,,吓一跳，以为是大张伟 
13166,2016-10-16 22:18 ,伊凝囫琦,,我以为是大张伟呢  看来我真是瞎的不清 
13167,2016-10-16 22:18 ,斯汀要好好长大,,我以为大张伟干啥事了呢，这热搜蹭的真棒 
13168,2016-10-16 22:18 ,独占敬亭山,大张伟,  
13169,2016-10-16 22:18 ,陈卟咚卟咚,,我第一反应大张伟干什么了 
13170,2016-10-16 22:18 ,Dabomb_,,看成大张伟🌚吓死我了 
13171,2016-10-16 22:17 ,老曹的小奶狗,,我开始也以为是大张伟 
13172,2016-10-16 22:17 ,我把可爱杀死了,大张伟, 还以为是你！吓死我了 
13173,2016-10-16 22:17 ,格桑花开LH,,一眼看成大张伟 
13174,2016-10-16 22:17 ,小扬sheep,,我以为看成大张伟的就我一人😂 
13175,2016-10-16 22:17 ,Hey王大哈,,这尼玛 第一眼看成大张伟 
13176,2016-10-16 22:17 ,吉米吉米吉米阿佳,,把说看成大张伟的评论都赞了一遍 
13177,2016-10-16 22:17 ,未言未书,,全都是看成大张伟的 
13178,2016-10-16 22:17 ,马可不boluo,大张伟,  
13179,2016-10-16 22:17 ,小心脏里的大世界,,把我吓了一跳啊！ 
13180,2016-10-16 22:17 ,楂卷,吴嘴GDREAM, 我也以为是大张伟呢哈哈哈看评论 
13181,2016-10-16 22:17 ,幼稚de西柚,,吓我一跳大张伟 
13182,2016-10-16 22:17 ,Via-Wu,,看成大张伟的不止我一个吧 
13183,2016-10-16 22:17 ,沐子小姐w,,看两遍都是大张伟什么鬼 瞎了 
13184,2016-10-16 22:17 ,更喜欢韩信,,妈的 看到大张伟立马我就进来了 然后 呵呵   张大伟？？？ 
13185,2016-10-16 22:17 ,聪明的吴同学,,我看了白天才反应过来是张大伟 
13186,2016-10-16 22:17 ,果子家5,,我也看成了大张伟 
13187,2016-10-16 22:17 ,我是徐大强,,看成大张伟的不止我一人🙋🏻 
13188,2016-10-16 22:17 ,二零一七级,,劳资以为是大张伟🙄 
13189,2016-10-16 22:17 ,dillion的马甲,,第一眼还以为大张伟 
13190,2016-10-16 22:17 ,是小羊o,,妈的 看成大张伟 
13191,2016-10-16 22:17 ,蝶舞翼3370,,我去！！！我以为是大张伟！！！！！！ 
13192,2016-10-16 22:17 ,眯柆ko,,错看成大张伟！ 
13193,2016-10-16 22:17 ,困兽_RunAway,,乍一看，看成大张伟。不管再怎么看还是看成大张伟 
13194,2016-10-16 22:17 ,EnnIee,,吓死我了  还以为是大张伟 
13195,2016-10-16 22:17 ,瓶盖小凡,,看成大张伟的就我自己？ 
13196,2016-10-16 22:17 ,LemonT-Tree-,,我居然看成了大张伟  
13197,2016-10-16 22:17 ,Mar菁,,大张伟 
13198,2016-10-16 22:17 ,王小雨雨要前進,,看成大张伟了🙃 
13199,2016-10-16 22:17 ,X薛小丹,,我以为是大张伟 
13200,2016-10-16 22:17 ,小暴脾气xin,,看成了大张伟 
13201,2016-10-16 22:17 ,林志颖家三宝,,只有我一个人以为是大张伟吗？ 
13202,2016-10-16 22:17 ,梦里花hu,,别跟我说就我一个人看成了大张伟 
13203,2016-10-16 22:17 ,忧忧一片云,,看评论我就放心了 大张伟 
13204,2016-10-16 22:17 ,DLet不爆炸,,看成大张伟的我 
13205,2016-10-16 22:17 ,新新新新么么哒哒哒,,吓我一跳！ 
13206,2016-10-16 22:17 ,-黄钰钰涵-,,尼玛我看成大张伟 
13207,2016-10-16 22:17 ,长泽芽孢杆菌yyyyyy,,看成大张伟 
13208,2016-10-16 22:17 ,TTTTTTTP,夕阳林下, 大张伟 
13209,2016-10-16 22:17 ,JunCicely_俊希,kookConfession, 
13210,2016-10-16 22:17 ,what圈儿,,又一次看成了大张伟 
13211,2016-10-16 22:17 ,小七七宝宝,,我看成大张伟了哈哈哈 
13212,2016-10-16 22:17 ,Mengmengya-,,看成大张伟的请抱紧我 
13213,2016-10-16 22:17 ,徐大梗5679416623,, 有百分之八十的人看错了大张伟吗 
13214,2016-10-16 22:17 ,逍遥公主Krystal,芍药猫姑娘, 我以为是大张伟 
13215,2016-10-16 22:17 ,bling不大,,第一反应竟然是张国伟。 
13216,2016-10-16 22:17 ,璐人瑤簡,,希望看成大张伟的不止我一个 
13217,2016-10-16 22:17 ,梦想家与狗,,我看成了大张伟 
13218,2016-10-16 22:17 ,反sb小分队队长在此谁与争锋,,来的每一个人都又重新看了一眼题目 
13219,2016-10-16 22:17 ,一个爱酸奶的胖胖,,我服了 我的眼睛 看了2遍看成大张伟 
13220,2016-10-16 22:17 ,总有刁民把朕当猴耍,,我是看成了大张伟才进来的，有人和我一样吗？😂😂 
13221,2016-10-16 22:17 ,源x雅,,我一开始还在想大张伟什么时候出国的 
13222,2016-10-16 22:17 ,PP说疯子是世界上最聪明的人,,看成大张伟的抱紧我 
13223,2016-10-16 22:17 ,湾仔老妖,大张伟, 
13224,2016-10-16 22:17 ,LEO陈,,我真的是看成了大张伟😂 
13225,2016-10-16 22:17 ,ZwwenjiingMaxx,,我还说花儿乐队那个为什么要自首呢 
13226,2016-10-16 22:16 ,粉红裤衩美壮士,果味爹, 
13227,2016-10-16 22:16 ,腐嗨无涯,,哈哈哈哈，第一眼看去以为是大张伟啊 
13228,2016-10-16 22:16 ,盲点,,看成了大张伟 
13229,2016-10-16 22:16 ,鱼尾味道也不错,,一眼看成大张伟，打开的时候还在想大张伟投什么 
13230,2016-10-16 22:16 ,ChloeJi紫凌,,我愣是看成大张伟 
13231,2016-10-16 22:16 ,爱折腾的兲蝎蓙,,妈呀还以为大张伟咋了结果看图片不是他呀，再仔细一看是张大伟谁啊？不认识 
13232,2016-10-16 22:16 ,一九九一三月,,还以为是大张伟 
13233,2016-10-16 22:16 ,周大大很暖哦,,评论，有毒 
13234,2016-10-16 22:16 ,Aboom_,,吓死我了…我以为是大张伟… 
13235,2016-10-16 22:16 ,听说ljq,,看成大张伟[互相膜拜] 
13236,2016-10-16 22:16 ,晓溪溪溪溪,,原来不止我一个人看成大张伟 
13237,2016-10-16 22:16 ,深晶饼,,为什么我每次都要看成大张伟 
13238,2016-10-16 22:16 ,鱼书Ka-Qing,,以为是大张伟犯事了呢 
13239,2016-10-16 22:16 ,可爱九妹,,看成大张伟赞我 叫我知道我不是一个人 
13240,2016-10-16 22:16 ,_杨怡晨_,,只有我自己看成大张伟了？ 
13241,2016-10-16 22:16 ,著民魔法师,,看成大张伟的点个赞吧 
13242,2016-10-16 22:16 ,阿九陪你到99,_trubo菜_,我竟看成了大张伟 
13243,2016-10-16 22:16 ,ZGeorgina,,多少人跟我一样看成了大张伟 
13244,2016-10-16 22:16 ,广曲比采,,晕死 我以为是唱嘻唰唰嘻唰唰…… 
13245,2016-10-16 22:16 ,想被腾爱的喵吖,,我看成了大张伟 
13246,2016-10-16 22:16 ,yeontingiye,我说大老师不好好的嘛！, 
13247,2016-10-16 22:16 ,何鑫悦在学习,,看成大张伟的在哪里 
13248,2016-10-16 22:16 ,钮祜禄渔童,,钱花没了就回来了 
13249,2016-10-16 22:16 ,小越越_yue,,有谁看成大张伟了 
13250,2016-10-16 22:16 ,七辻屋的娘口,,大张伟 
13251,2016-10-16 22:16 ,汪汪是个单身狗,,以为大张伟，靠，看了是贪官两字我才又把名字看了一下，张大伟啊！ 
13252,2016-10-16 22:16 ,周大大很暖哦,,hahaha，看成大张伟了 
13253,2016-10-16 22:16 ,是瑶瑶瑶呐,,看到大张伟了T_T吓死宝宝了 
13254,2016-10-16 22:16 ,YLY杨铃玉,,吓我一跳 我以为大张伟怎么了 
13255,2016-10-16 22:16 ,小熊宝宝很呆萌,,大张伟 
13256,2016-10-16 22:16 ,Color白猫浮绿水,,看成大张伟的还有谁！举手我看看 
13257,2016-10-16 22:16 ,张小兔大人Rainnee,,大老师怎么啦？ 
13258,2016-10-16 22:16 ,SJSJSJ0513,,大张伟 炒作 
13259,2016-10-16 22:16 ,言情小说在这里,,我一开始真的看成了，大张伟。😂 😂 
13260,2016-10-16 22:16 ,张张张倩媛,,看成大张伟 
13261,2016-10-16 22:16 ,枝昂荷翁,,甚至看成了张国伟 
13262,2016-10-16 22:16 ,Ch21s,,我以为是大张伟 
13263,2016-10-16 22:16 ,Zicole,,大张伟...我应该不是一个人 
13264,2016-10-16 22:16 ,尛尛柠檬君,cengceng-_-, 不止我一个人看成大张伟 
13265,2016-10-16 22:16 ,梦中的翼年代,,就问一句，有多少人看成大张伟 
13266,2016-10-16 22:16 ,天天天蓝jhy,,原来不只我一个人看成大张伟啊还吓了一跳 
13267,2016-10-16 22:16 ,关wee尼,,我看成大张伟…… 
13268,2016-10-16 22:16 ,江流儿anny,, 
13269,2016-10-16 22:16 ,Zhao_1128只烊,,看成大张伟了 
13270,2016-10-16 22:16 ,陈晓蓝cw,,我在想还有谁是没有看成大张伟的 
13271,2016-10-16 22:16 ,SeraphimYL,,看错大张伟 
13272,2016-10-16 22:16 ,本宝宝好可爱呀,,我就来看看有多少人看成了大张伟 
13273,2016-10-16 22:16 ,不要那么喜欢买衣服了,,以为是大老师， 
13274,2016-10-16 22:16 ,可爱动人的倪,,我以为是大张伟 
13275,2016-10-16 22:16 ,花啦啦08042,,大老师怎么啦？人怕出名猪怕壮啊！ 
13276,2016-10-16 22:16 ,董明星_Xxxxxxx,,我居然看成了大张伟 
13277,2016-10-16 22:16 ,嗒嗒故事的小黃花,看成了大张伟,@大张伟 
13278,2016-10-16 22:16 ,JIZZ-113,,握草 我以为大张伟 
13279,2016-10-16 22:16 ,好菇凉光芒万丈ko,,妹的，我看成大张伟了，吓死了 
13280,2016-10-16 22:16 ,你的微笑是我最大的动力1,,我以为大张伟  就点进来了😥😒😒 
13281,2016-10-16 22:16 ,哒哒龙-ND,,我尼玛还看了几遍 大张伟，，，怎么了，，，难道当时的抄袭风波被抓了？ .....才醒过味儿来 张大伟 
13282,2016-10-16 22:16 ,real___hyun7,,完了完了我也看成大张伟了 
13283,2016-10-16 22:16 ,你说将来要娶我进门,,我以为大张伟 
13284,2016-10-16 22:16 ,馨妹妹-LYF,,第一眼以为是大张伟 
13285,2016-10-16 22:16 ,aspirin-u,,看成大张伟了😂 
13286,2016-10-16 22:16 ,逗逼好美好美的红蔷薇,,评论全是大张伟。。。 
13287,2016-10-16 22:16 ,我家喵喜欢你,,第一眼看成大张伟 
13288,2016-10-16 22:16 ,是否rrrr,,妈的 是不是都看成了大张伟啊 
13289,2016-10-16 22:16 ,满天星de爱,,以为是大张伟，反应半天，原来不止我一个人看错 
13290,2016-10-16 22:16 ,女神hold住,,我把看成大张伟的都赞了一遍 
13291,2016-10-16 22:15 ,圆滚滚的甜蜜饯儿,,看成大张伟了。我去有一样的么 
13292,2016-10-16 22:15 ,光脚大傻子,,大张伟怎么了 
13293,2016-10-16 22:15 ,不吃菠萝味粑粑的刘阿姨,,看成大张伟哈哈哈 
13294,2016-10-16 22:15 ,小柒Q_Q,,看成大张伟了 
13295,2016-10-16 22:15 ,周Max_,,他妈的看成了大张伟 
13296,2016-10-16 22:15 ,沈公子小童鞋,,多少人看成了大张伟 
13297,2016-10-16 22:15 ,心中不良人,,我想知道有多少人看成了大张伟 
13298,2016-10-16 22:15 ,--丑得心疼,,有多少看成大张伟的？ 
13299,2016-10-16 22:15 ,O唐宝,,还以为大张伟 
13300,2016-10-16 22:15 ,舒克舒克sk,,大张伟＋1 
13301,2016-10-16 22:15 ,短发显个儿高,,竟然看成了大张伟 
13302,2016-10-16 22:15 ,纯白酱酱,,我以为是大张伟 
13303,2016-10-16 22:15 ,一只娘man,,看成大张伟 
13304,2016-10-16 22:15 ,小心心的心儿,,身为大张伟路人粉 吓了一跳 
13305,2016-10-16 22:15 ,LILEI221,,艾玛！差点以为大张伟呢 
13306,2016-10-16 22:15 ,Dannyxx,,没看评论之前我一直看成的是大张伟 
13307,2016-10-16 22:15 ,cc大杨,,卧槽 ，我还以为大张伟， 
13308,2016-10-16 22:15 ,杨晗呀,叫我皮欢欢,同 
13309,2016-10-16 22:15 ,捡破烂的破小孩儿,,我去，我以为是大张伟 
13310,2016-10-16 22:15 ,揪心的玩笑与漫长的白日梦Woo,,吓死宝宝了 
13311,2016-10-16 22:15 ,不甘与不配,,大张伟 
13312,2016-10-16 22:15 ,不思敬亭,,看成大张伟 吓死我了 
13313,2016-10-16 22:15 ,_YUooo,_trubo菜_,我也是 
13314,2016-10-16 22:15 ,kookConfession,王嵩嵩k, 妈的我以为大张伟搞事情了 
13315,2016-10-16 22:15 ,水冰小阿花_哇,,我，看成了大张伟，吓我一跳 
13316,2016-10-16 22:15 ,一朵猫c,,告诉我不是只有我一个人看成了大张伟，我还看了两遍✌️ 
13317,2016-10-16 22:15 ,二十四城下,,我看成了大张伟，心想他犯什么错了 
13318,2016-10-16 22:15 ,翛肆Essie,,吓死奶奶了，我家大老师啊，太让人操心 
13319,2016-10-16 22:15 ,文大大叫你一声你敢应么,,卧槽，告诉我不只我一个人看成了大张伟 
13320,2016-10-16 22:15 ,叫我皮欢欢,杨晗呀, 
13321,2016-10-16 22:15 ,vvv确定,,好以为是大张伟 
13322,2016-10-16 22:15 ,我最爱的喜之郎,,厉害了我的哥我也看成了大张伟 
13323,2016-10-16 22:15 ,叶子的私奔,,吓死，以为大张伟 
13324,2016-10-16 22:15 ,简单-才好,,看成了大张伟 
13325,2016-10-16 22:15 ,Rclmzh--,,吓我一跳...看成了大张伟 
13326,2016-10-16 22:15 ,奶盖少冰三分甜,,眼花看成了大张伟 
13327,2016-10-16 22:15 ,梁小然然然啦,,我的妈都看成大张伟了 
13328,2016-10-16 22:15 ,hey-June6028435144,,看评论，原来不是一个人看错人名…… 
13329,2016-10-16 22:15 ,南朋友94_,,唔，，看成大张伟了 
13330,2016-10-16 22:15 ,第三层楼的阿鹿looo,,大张伟 
13331,2016-10-16 22:15 ,Meylisa莎莎,,第一时间去翻大张伟的微博 
13332,2016-10-16 22:15 ,vivitfboys,,我看成了大张伟 
13333,2016-10-16 22:15 ,家明w,,第一眼还以为大张伟 
13334,2016-10-16 22:15 ,taihengxi,,吓死我了  看成了大张伟 
13335,2016-10-16 22:15 ,杭州小可爱--,,不只我一个人看成大张伟吧 
13336,2016-10-16 22:15 ,陈小欣文大文,,可能大张伟看到这个新闻也会被吓到 
13337,2016-10-16 22:15 ,Suanran_苏安然,,我也是第一眼看成了 大张伟😂😂😂😂😂 
13338,2016-10-16 22:15 ,向日葵的微笑ygy,,我看成了大张伟  吓死了 
13339,2016-10-16 22:15 ,蝶歌声声,,只有我一个人看成大张伟吗 
13340,2016-10-16 22:15 ,八卦源于生活,,原来不只我一个看成大张伟 
13341,2016-10-16 22:15 ,阿阿阿qie,,大张伟 张大伟 
13342,2016-10-16 22:15 ,VVincy_一的菌,,吓死我了我看成大老师了，这给我吓得 
13343,2016-10-16 22:15 ,李-四四,,吓我一跳，以为大张伟 
13344,2016-10-16 22:15 ,诡娃,,我以为大张伟。。。 
13345,2016-10-16 22:15 ,M晚情,,我还以为只有我一人看成了大张伟 
13346,2016-10-16 22:15 ,爱玩的谢大大,,吓我一跳，看成大张伟 
13347,2016-10-16 22:15 ,煭焰z,,大张伟 我不是一个人 
13348,2016-10-16 22:15 ,y一个傲娇的小女子,,我也看成大张伟 
13349,2016-10-16 22:15 ,c1ow_Min,,我也看成大张伟了 
13350,2016-10-16 22:15 ,A_酷酷的欧尼,,我在想大张伟为什么要自首 
13351,2016-10-16 22:15 ,你该换件外套了啊,,我踏马的看成了大张伟 
13352,2016-10-16 22:15 ,鱼鱼鱼大鱼小鱼好多鱼,,我还说大张伟咋了……→_→ 
13353,2016-10-16 22:15 ,胡萝卜的小黑兔,大张伟, 
13354,2016-10-16 22:15 ,灬灬灬灬灬灬灬Julie,,全体都被套路了 
13355,2016-10-16 22:15 ,越努力学可爱_,,原来看成大张伟的不只是我 
13356,2016-10-16 22:15 ,RenAxi,,以为大张伟点进来 
13357,2016-10-16 22:15 ,果果果果果果果冻儿,,看成大张伟 
13358,2016-10-16 22:15 ,明恋吾心,,我明明看的是张大伟，但是心里默念出来的还是大张伟哈哈哈哈😂 
