4628,2016-10-17 08:56 ,筱_小小呆,,看到评论感觉好多了……以为就我眼缺…… 
4629,2016-10-17 08:55 ,Z柠檬说,,他妈第一眼绝逼看成了大张伟 
4630,2016-10-17 08:55 ,米饭只爱勺子妹,,大张伟看样子你讲段子是犯法的 
4631,2016-10-17 08:55 ,比胖达还胖11,,看成了大张伟，一直在想大老师什么时候潜逃的怎么都没有消息，再一看才发现看错了。 
4632,2016-10-17 08:55 ,张大晶呀,,我以为是人间精品大张伟 
4633,2016-10-17 08:55 ,木头的木00,,昨天晚上扫了一遍这个新闻看到的是大张伟，今天有看了一遍还以为是大张伟，眼睛有问题啦 
4634,2016-10-17 08:55 ,XU-xiaohan,,看成了大张伟。。。。还在想大张伟为什么要自首。。。。。 
4635,2016-10-17 08:55 ,丢丢020,,第一眼吓尿了以为是大张伟 
4636,2016-10-17 08:55 ,纯白衬衫_,,我他妈以为大张伟 
4637,2016-10-17 08:55 ,公民198410,,我怎么总算看成“大张伟回国自首”？ 
4638,2016-10-17 08:55 ,叫我小菠萝,,吓尿看成了大张伟.... 
4639,2016-10-17 08:54 ,齐娅楠为什么辣么聪明Awwww-,,看成大张伟吓我一跳 
4640,2016-10-17 08:54 ,Ling-OYJ,,还以为大张伟名叫张大伟…… 
4641,2016-10-17 08:54 ,嘎嘣脆的彤彤彤,,妈的看成了大张伟 
4642,2016-10-17 08:54 ,M柔M7,,我也看错了！ 
4643,2016-10-17 08:54 ,卫大好人,,以为大张伟 
4644,2016-10-17 08:54 ,EXO_Xback朱比亚,,靠  看成大张伟  吓我一跳 
4645,2016-10-17 08:54 ,知否知否应是相思红豆,,看成大张伟 
4646,2016-10-17 08:54 ,资阳味道,,达赖八十几了还没有劝回来呢该严打的 
4647,2016-10-17 08:54 ,Cathy圆圆儿,Cindy_GYZ, 
4648,2016-10-17 08:54 ,惠子小姐姐1,,只有我看成大张伟了吗？ 
4649,2016-10-17 08:54 ,小嫩仔_星哥哥,,我看成了大张伟 
4650,2016-10-17 08:53 ,一只偷懒的猫__,,张大韦回国，看成了张国伟😂 
4651,2016-10-17 08:53 ,星星兔_123,,😂😂😂我以为是大张伟 
4652,2016-10-17 08:53 ,进击的木棉WWW,,多少人是看成大张伟才点进来的😂 
4653,2016-10-17 08:53 ,Sammi魚猫,,乍一看，大张伟 
4654,2016-10-17 08:53 ,顾沫海,,我以为大张伟那 我就赶紧点过来看， 
4655,2016-10-17 08:53 ,--北溟有魚,,张大伟大张伟，，，傻傻分不清楚。 
4656,2016-10-17 08:53 ,Angela涵-小艺,,哈哈，大张伟犯什么事了！以为他吸毒了！哈哈。。。看错的人好多！ 
4657,2016-10-17 08:53 ,晴空紫妍,,大张伟关我啥事 
4658,2016-10-17 08:53 ,一个网友一夜暴瘦,,果然大家都看成了大张伟 
4659,2016-10-17 08:53 ,池水渺,,看成了大张伟 
4660,2016-10-17 08:53 ,简单老洋,,大张伟这是犯啥事了啊？ 
4661,2016-10-17 08:53 ,一页柠檬草,,乍一看以为大张伟 
4662,2016-10-17 08:53 ,wttxbb,,看成大张伟才进来的 
4663,2016-10-17 08:52 ,JANE陈祈言,,哈哈哈我以为是大张伟 
4664,2016-10-17 08:52 ,乾小都爱小傻燕,,特么的看错成大张伟 😂 😂 😂 
4665,2016-10-17 08:52 ,Lancevaudray,,看成大张伟的抱紧我 
4666,2016-10-17 08:52 ,晋白白白白白,,第一反应大张伟！ 
4667,2016-10-17 08:52 ,汉娜塔莉,,表示与众人一样 
4668,2016-10-17 08:52 ,小蝎子-薇兒,,妈呀，看成大张伟，还寻思欢乐活脱的大张伟怎么就犯罪了呢？犯啥罪都来不及看，满脑子大张伟的画面。 
4669,2016-10-17 08:52 ,薛之刺,,我在想我大老师怎么成犯罪嫌疑人了  😂 
4670,2016-10-17 08:52 ,Schneeschuh,,第一眼看成大张伟 
4671,2016-10-17 08:52 ,梦见小莱会开花,,不是我一个人看成大张伟 
4672,2016-10-17 08:52 ,喂不吃肉会死啊,,吓死我了，我以为是嘻唰唰的大张伟 
4673,2016-10-17 08:51 ,张小蜜蜜子,,吓我一天，我看成大张伟了 
4674,2016-10-17 08:51 ,青衫红袖H,,看评论才知这么多人看成了大张伟，还纳闷他这是咋了，原来…… 
4675,2016-10-17 08:51 ,茶谅,,我给看成了大张伟 
4676,2016-10-17 08:51 ,甜菜君的小迷妹,,有多少人看成大张伟 
4677,2016-10-17 08:51 ,AnDromedaaa-,,把看成大张伟的都赞了一遍😂😂 
4678,2016-10-17 08:51 ,尝尝沙包大的拳头,大张伟,  
4679,2016-10-17 08:51 ,笑笑winwin喵,,卧槽看成大张伟了 
4680,2016-10-17 08:51 ,菰茗哈,,靠，你妹！下我一跳 
4681,2016-10-17 08:51 ,伊品欧卡乔,,看成了大张伟，吓死 
4682,2016-10-17 08:51 ,权权权鸡涌08188,,看成大张伟的真的不是我一人 
4683,2016-10-17 08:51 ,雅clara,,吓死宝宝了，看成大张伟了，看来不止我一人这样啊 
4684,2016-10-17 08:50 ,Happy_sir_狒狒狒,,🍌 
4685,2016-10-17 08:50 ,我是掌萌人,,大张伟？ 
4686,2016-10-17 08:50 ,我想去童话镇,,看成了大张伟 
4687,2016-10-17 08:50 ,ECHO楚子,,看去大张伟 
4688,2016-10-17 08:50 ,一切如故渝,,吓死了还以为大张伟 
4689,2016-10-17 08:50 ,哎哟喂小洗呀,,吓死我了我还以为大张伟 
4690,2016-10-17 08:50 ,蓝蓝蓝蓝蓝o0,大张伟,  吓我一跳 
4691,2016-10-17 08:50 ,余鶴子,,原谅我看成了大张伟 
4692,2016-10-17 08:50 ,十里八乡第一美女,,大张伟 
4693,2016-10-17 08:50 ,Hello洋子酱,忆思宛,哈哈哈，我以为他犯事了😂 
4694,2016-10-17 08:50 ,小短腿胖胖的,,你妹啊 我看成大张伟了…… 
4695,2016-10-17 08:50 ,Eternal丿love,,哈哈哈看成大张伟的不止我一个 
4696,2016-10-17 08:50 ,蔓蔓长大好吗,,张大伟。哈哈我以为大张伟😂😂😂 
4697,2016-10-17 08:50 ,Rorschach_Ni,,看成大张伟的人，请举手 
4698,2016-10-17 08:49 ,SFC-走心,,吓死宝宝了  还好不是大张伟  天呐， 
4699,2016-10-17 08:49 ,王王王生当,,看成大张伟的抱紧我 
4700,2016-10-17 08:49 ,鱼木L,,我竟然看成大张伟 
4701,2016-10-17 08:49 ,叨比叨精灵,,看成大张伟 
4702,2016-10-17 08:49 ,许白茶,,把看成大张伟的都赞了一遍 
4703,2016-10-17 08:49 ,ZJ一笑奈何,,吓死我了…我还说尼玛大老师能犯啥事搞成这样 
4704,2016-10-17 08:49 ,-陆初二,,我就进来看看多少人看成大张伟结果都尼玛看成大张伟 
4705,2016-10-17 08:49 ,橙幸运-,,看成大张伟 
4706,2016-10-17 08:49 ,Sunshine薛,,我也看成了大张伟   吓我一跳😂😂😂 
4707,2016-10-17 08:49 ,遇见你温柔如初,,如果没看成大张伟我都不会点进来 
4708,2016-10-17 08:49 ,听说_TS,,看了两遍看成了大张伟 
4709,2016-10-17 08:49 ,Q嗷嗷嗷Q,,看到评论都说是大老师  我就放心了 
4710,2016-10-17 08:49 ,小胡看看姐姐吧,¡,评论配图 
4711,2016-10-17 08:49 ,kdgajdp,,大张伟 
4712,2016-10-17 08:49 ,好訫晴,,还以为大张伟肿么了 肿么会犯事? 
4713,2016-10-17 08:49 ,Alice无梦游不仙境,,真的一眼看错大张伟吓我一跳 
4714,2016-10-17 08:48 ,PCSayYeol_LH,TinTinDaphy, 第一眼我也看成了大张伟 
4715,2016-10-17 08:48 ,边萌兔,,我还以为是大张伟 
4716,2016-10-17 08:48 ,唔里撒拉哈吉码啦哟,,不是就我一个看成大张伟吧 
4717,2016-10-17 08:48 ,小葵_0906,,我也看个大张伟 
4718,2016-10-17 08:48 ,鲨鱼座少女,,只有我一个看成是大张伟吗！！ 
4719,2016-10-17 08:48 ,小名叫王磊,,看成大张伟了 
4720,2016-10-17 08:48 ,雨寒吃秋柳,, 手机看大片[讥笑]   ¡评论配图 
4721,2016-10-17 08:48 ,-老杨阿姨-,,我居然看成了大张伟 
4722,2016-10-17 08:48 ,活力蔓越莓_bululu,李-浩-浩, 原来不是我一个人看成了大张伟 
4723,2016-10-17 08:48 ,真是一条狗呀,,大张伟犯啥事了？老公！ 
4724,2016-10-17 08:48 ,国际尸房鬼片馆,,大张伟 
4725,2016-10-17 08:48 ,为什么辣么严肃,,我昨天就开始看了 一直以为是大张伟 看评论才知道是张大伟 
4726,2016-10-17 08:48 ,_璇哥哥,,我也看错了。。。吓一跳 
4727,2016-10-17 08:48 ,·Sone,,原来这么多人看成了大张伟 
4728,2016-10-17 08:48 ,Ivy慧小慧,,妈呀，我看成大张伟了 
4729,2016-10-17 08:48 ,小饭桶菇凉,,我以为大张伟 进来看看😄 
4730,2016-10-17 08:47 ,您的好友范大胆以上线,,- -以为是大张伟 
4731,2016-10-17 08:47 ,於枕尺,,哈哈哈，好多都是看成大张伟进来的 
4732,2016-10-17 08:47 ,尤物陈变变,,大张伟又吸毒了 
4733,2016-10-17 08:47 ,cinderellaaaaaaaaa,,只有我一个看成了大张伟吗 
4734,2016-10-17 08:47 ,朱小轩shine,,云南的，没有不贪，不要问为什么 
4735,2016-10-17 08:47 ,吉琪嘻,,对不起哈，我还以为是大张伟 
4736,2016-10-17 08:47 ,CRYSTAL_浮沉,,我看了无数遍都觉得是大张伟 
4737,2016-10-17 08:47 ,ONEmore湃,,大张伟 
4738,2016-10-17 08:47 ,苦逼上班族99,,有多少人第一眼看成了大张伟 
4739,2016-10-17 08:47 ,MISS喵_Z,,炸一看我还以为是大张伟呢 
4740,2016-10-17 08:47 ,胡胡胡胡胡胡椒粉,,看成了大张伟😱😱😱 
4741,2016-10-17 08:47 ,共勉q,,看成大张伟。。 
4742,2016-10-17 08:47 ,Cecilialllo,,我竟然看成了大张伟 
4743,2016-10-17 08:46 ,我叫赵小强O_o,,吓死了，大张伟 
4744,2016-10-17 08:46 ,papa_解,,吓我一跳，我以为大张伟犯事了 
4745,2016-10-17 08:46 ,轩辕六能,,不止一次看成大张伟 
4746,2016-10-17 08:46 ,粥可温x,桃花庵下似神仙,图片评论 O网页链接 
4747,2016-10-17 08:46 ,Jimlew壹见你就笑,,心疼大张伟，， 
4748,2016-10-17 08:46 ,Tuzki_没表情,,告诉我不是我一个看成大张伟 
4749,2016-10-17 08:46 ,小小小阿张_,,妈哒  还以为大张伟 
4750,2016-10-17 08:46 ,嗨嗨沧,,是因为涉嫌抄袭吗？ 
4751,2016-10-17 08:46 ,巨蟹座的高小姐,,只有我看成了大张伟了吗 
4752,2016-10-17 08:46 ,橙幂Mi,,难道只有我一个人看成了大张伟吗 
4753,2016-10-17 08:45 ,于也航,,钱在外国造完了，就回国了，枪毙，算了 
4754,2016-10-17 08:45 ,库斯特林圣火,,我去，乍一看以为是大张伟 
4755,2016-10-17 08:45 ,月球上的彩色天坑,,拿枪对着你的家人的劝返？我是不相信什么良心谴责为爱回归 
4756,2016-10-17 08:45 ,歪的脖子疼,,看成大张伟了！ 
4757,2016-10-17 08:45 ,薛定谔的雄猫,,贪官外逃被抓 国际惯例赃款得分一部分给所在国 看来劝返是不用 
4758,2016-10-17 08:45 ,子阳丶杨杨杨杨杨杨,,看成大张伟的赞我 
4759,2016-10-17 08:45 ,杨姑娘0917,,你妹，看成大张伟才进来看的！ 
4760,2016-10-17 08:45 ,Chengtimberlake,,大张伟 
4761,2016-10-17 08:45 ,阿狸阿狸笨阿狸,,大张伟 张大伟  傻傻分不清楚 
4762,2016-10-17 08:44 ,Kyra的kk,,我还以为是大张伟 
4763,2016-10-17 08:44 ,94荼蘼,,一觉起来以为大张伟犯了事 
4764,2016-10-17 08:44 ,Mayzell,,把看成大张伟的全部赞了一遍 
4765,2016-10-17 08:44 ,相见不如怀念呀_,,评论都是一个套路啊 
4766,2016-10-17 08:44 ,情话余她,,老子以为大张伟犯法了呢！ 
4767,2016-10-17 08:44 ,可可豆SLH,,这名字简直了，这下好  嫌犯还成名人了 
4768,2016-10-17 08:44 ,小小小小小甜甜甜,,我以为大张伟😣 
4769,2016-10-17 08:44 ,最痛的痛是原谅丷,,还以为是大张伟了⋯⋯ 
4770,2016-10-17 08:44 ,相见不如怀念呀_,,以为是大张伟 
4771,2016-10-17 08:44 ,辛小麦,,看到大家都看成大张伟，我就放心了 
4772,2016-10-17 08:44 ,珞清-,,有毒大张伟 
4773,2016-10-17 08:44 ,孟大爷美颜盛世,,一眼看成大张伟好了我要去做眼保健操了 
4774,2016-10-17 08:43 ,Hepcat霏,,我真的第一眼看见是大张伟才点进来的😏😏 
4775,2016-10-17 08:43 ,齁儿甜的,丁琪芝, @一1一八 @邢梓芯啊 
4776,2016-10-17 08:43 ,学画画的女青年,,宝宝看成大张伟了 
4777,2016-10-17 08:43 ,The森Monster,,有多少人和我一样总看成大张伟！！ 
4778,2016-10-17 08:43 ,我是你的芝麻啊,,妈的，我以为是大张伟！   好尴尬啊 
4779,2016-10-17 08:43 ,恋爱星zrh,,我以为大张伟，给我心里一惊 
4780,2016-10-17 08:43 ,_NLLLLIV,,吓死我 看成大张伟 
4781,2016-10-17 08:43 ,刘四土很洋气,大张伟, 哈哈哈哈 
4782,2016-10-17 08:43 ,轻风来临,,大张伟，你要搞事情？😂😂 
4783,2016-10-17 08:43 ,丁丁里个当当,,原来不止是我看成了大张伟啊 
4784,2016-10-17 08:43 ,久别自然莫思量,,看了两天，每次都看错 
4785,2016-10-17 08:43 ,林林林林君_,,看成大张伟 
4786,2016-10-17 08:43 ,木子长聿,,我妈一直说大张伟被通缉，我还不信… 
4787,2016-10-17 08:43 ,荞麦不冷,,看成大张伟的我一脸萌比 
4788,2016-10-17 08:42 ,Jack何老师,,我也是，大张伟 
4789,2016-10-17 08:42 ,非段子不搞笑,,最近眼神不太好使那么就我特么第一眼看成大张伟吗？ 
4790,2016-10-17 08:42 ,1ikeuy,,哈哈哈哈 我也以为是大张伟 
4791,2016-10-17 08:42 ,钟情-Y__,,我以为大张伟，妈妈呀，大张伟你赶紧出来看看吧 
4792,2016-10-17 08:42 ,Xback微笑yix,,看成大张伟了 
4793,2016-10-17 08:42 ,黄赟lucky,,我看成了大张伟，吴大伟 
4794,2016-10-17 08:42 ,我昨天梦到高哥了,,谁能把标题给我断个句 
4795,2016-10-17 08:42 ,Lynn麗麗麗麗麗,,我也看成了大张伟 
4796,2016-10-17 08:42 ,马韵寒,,吓死我了，以为大老师。 
4797,2016-10-17 08:42 ,木有鱼丸唉xi,,我以为是大张伟 
4798,2016-10-17 08:42 ,果果家族的守护,,张大伟是啥？大张伟跟他没关系吧 
4799,2016-10-17 08:42 ,密林大王美如画,,吓死我 ！！！我看成了大张伟。。。 
4800,2016-10-17 08:42 ,文艺范hh,,大张伟…… 
4801,2016-10-17 08:42 ,只是辣妈,,看成大张伟的我！ 
4802,2016-10-17 08:42 ,暴走中的淑女,,第一眼看成大张伟了，吓我一跳！还以为他犯什么事了 
4803,2016-10-17 08:42 ,-改改就是小公举-,,对不起我看成了大张伟 
4804,2016-10-17 08:42 ,婷婷酱byba,,这评论都好统一 
4805,2016-10-17 08:42 ,axaxxaxacc,错赴, 
4806,2016-10-17 08:42 ,Lamia卍,,看错了以为是大张伟 
4807,2016-10-17 08:42 ,殿下的七月,,我还纳闷唱歌的咋成了逃犯，抄袭这么大罪过？ 
4808,2016-10-17 08:41 ,商丘工学院教育与现代艺术学院,,第一眼看成了大张伟 
4809,2016-10-17 08:41 ,爱吃鱼的赵日天,,三天了，看了N次，还是第一眼看成大张伟 
4810,2016-10-17 08:41 ,si思_cri,,看成大张伟 
4811,2016-10-17 08:41 ,郭佳蕴YY,,不是我一个人看错 
4812,2016-10-17 08:41 ,你的名字---贺兰觽,,心里一跳，尼玛以为是大张伟 
4813,2016-10-17 08:41 ,发条Yellow,,要不是大家都看成大张伟  恐怕也没这么热 
4814,2016-10-17 08:41 ,兔纸乖乖的呦,,看了三遍大张伟 
4815,2016-10-17 08:41 ,哼哼哈嘿胖虎附体,,还以为大张伟怎么了呢 
4816,2016-10-17 08:41 ,琳子一天啊,,还以为是大张伟 
4817,2016-10-17 08:41 ,8Needu,,我只知道大张伟啊 
4818,2016-10-17 08:41 ,热爱苏斯,,看成了大张伟 
4819,2016-10-17 08:41 ,Neko沒有錢,,哈哈哈99%的人看成大张伟包括我 
4820,2016-10-17 08:41 ,刘菲艳_LFY,,我把和我一样看成是大张伟的都赞了一遍 
4821,2016-10-17 08:41 ,趣多多不吃豆_,,看成了大张伟 
4822,2016-10-17 08:41 ,大水冰月月月月月,,只有我看成大张伟么 
4823,2016-10-17 08:41 ,yyyyyy可樂,,差点看成大张伟 
4824,2016-10-17 08:41 ,紫藤花第一个网名,,我看成大张伟了 
4825,2016-10-17 08:41 ,勿薄,,看到这么多大张伟我就放心了…… 
4826,2016-10-17 08:40 ,张宝宝想要一片天,,我以为大张伟。但是又觉得名字别别的。也是没sei了。 
4827,2016-10-17 08:40 ,萱毅_LOVE,,吓了我一跳，看成了大张伟 
4828,2016-10-17 08:40 ,土匪灬唱情歌,,大张伟 张大伟，厉害了 
4829,2016-10-17 08:40 ,sun是我爱豆,,看成大张伟[震惊] 
4830,2016-10-17 08:40 ,阿耶啊_,,好吧，我承认我第一眼看错了 
4831,2016-10-17 08:40 ,芒果Core,,大张伟犯什么事了 
4832,2016-10-17 08:40 ,Jealousy_x,,猛一看 以为大张伟抄袭被抓了 
4833,2016-10-17 08:40 ,_丁大仙儿_,,我以为大张伟 或是 张国伟 
4834,2016-10-17 08:40 ,韩沉的女友小板面,冰饼冰饼冫水, 哈哈哈哈哈哈哈哈哈哈大张伟张大伟 
4835,2016-10-17 08:40 ,sunny_窝,,有多少人看成了大张伟？我相信不止我一个。。。 
4836,2016-10-17 08:40 ,忙着变可爱吖,,大张伟无辜躺枪 
4837,2016-10-17 08:39 ,8821个爱你,,看成大张伟了！迅速我就点进来看看！ 
4838,2016-10-17 08:39 ,Qyx-my,,我就进来看看有多少人跟我一样看成了大张伟 
4839,2016-10-17 08:39 ,斑马灰灰,,看成了大张伟 
4840,2016-10-17 08:39 ,洒脱O红颜,吴邪带我回家V,我也是 
4841,2016-10-17 08:39 ,_大雯子_,,看成大张伟了 
4842,2016-10-17 08:39 ,忆思宛,丨ZHANGYANG丨,不是大张伟，是张大伟 
4843,2016-10-17 08:39 ,Ron的肉花花,,直接看成大张伟 
4844,2016-10-17 08:38 ,皇甫红妹,,第一次见热评这么统一，全都是大张伟😂 
4845,2016-10-17 08:38 ,_xxx_yinshuer,,不止我一个人看成大张伟的吧 
4846,2016-10-17 08:38 ,LilyrenP-,,看成大张伟投案自首 
4847,2016-10-17 08:38 ,我心__悠然,,第一眼看成大张伟 
4848,2016-10-17 08:38 ,Jarryd_Roin,,我还以为大张伟终于承认多年抄袭了 
4849,2016-10-17 08:38 ,Liuies--,,以为大张伟。 
4850,2016-10-17 08:38 ,咖米乐,,大张伟回归投案自首 
4851,2016-10-17 08:38 ,檬檬麻麻AA,,只有我一个人看成大张伟吗 
4852,2016-10-17 08:38 ,在下可是一股清流阿,大张伟, 
4853,2016-10-17 08:38 ,Soya_林,,看成大张伟的肯定不止我一个。 
4854,2016-10-17 08:38 ,leehom8023的天涯,,一下看成大张伟。。。。。 
4855,2016-10-17 08:38 ,唉吃瓜皮的皮皮虾,,所有人都看成大张伟了嘎嘎嘎 
4856,2016-10-17 08:38 ,你家小豆,,靠，我还以为是大张伟 
4857,2016-10-17 08:37 ,一位不愿透露姓名的雯丫头,,我看成大张伟了 
4858,2016-10-17 08:37 ,沈清巴拉巴拉,,竟然一眼看成大张伟 
4859,2016-10-17 08:37 ,淼卟咯言,,有多少人看成了大张伟 
4860,2016-10-17 08:37 ,二四污,,我特么也看成大张伟了 还很诧异的点开看 
4861,2016-10-17 08:37 ,意义丶是你,,我以为大张伟。。。 
4862,2016-10-17 08:37 ,于珍珠Lynn,,大张伟➕1 
4863,2016-10-17 08:37 ,安於爾一個滨,#法医秦明#,减肥神剧→_→1-6集已看完需要的滴滴我+Vslhy0201 
4864,2016-10-17 08:37 ,你用单手遮住了我的眼Yi,,冲着大张伟来的 
4865,2016-10-17 08:37 ,桔子卤,,我居然看成了大张伟 
4866,2016-10-17 08:37 ,追风少女阿狗,,总感觉是大张伟🙈 
4867,2016-10-17 08:37 ,石月溪,,大张伟躺枪。 
4868,2016-10-17 08:37 ,嘎宝宝好开心,,原来不止我一个 
4869,2016-10-17 08:36 ,流殇微凉M,,玛德，看成大张伟 
4870,2016-10-17 08:36 ,goooleen,,我杂一看  以为是大张伟  哎呀 妈呀 
4871,2016-10-17 08:36 ,傻乎乎的小爽爽,,原来这么多人和我一样！都看成大张伟啦！哈哈哈哈！ 
4872,2016-10-17 08:36 ,小乔留睡我家,,我看成大张伟 
4873,2016-10-17 08:36 ,Z-gsq,,告诉我不是我一个人看成大张伟了 
4874,2016-10-17 08:36 ,紫冰零落,,看错咯，以为此大张伟，非此大张伟 
4875,2016-10-17 08:36 ,lnuyasha白,,同上 
4876,2016-10-17 08:36 ,Hello洋子酱,,大张伟咋了 
4877,2016-10-17 08:36 ,嘎嘎JyZh,,标题有毒，第一眼都看成大张伟 
4878,2016-10-17 08:36 ,周丸子的-c_heung,吃土少女周丸子, 我还以为大张伟 
4879,2016-10-17 08:36 ,啵啵的小仙女呀,,原来不止我一个人看成大张伟 
4880,2016-10-17 08:36 ,赵小小小小小一,,吓死我了，以为大张伟 
4881,2016-10-17 08:35 ,你好榆林,,我以为是大张伟 
4882,2016-10-17 08:35 ,辰小夕的,,看成了大张伟，呵呵 
4883,2016-10-17 08:35 ,叫你一声大哥你敢答应嘛,,‍把张大伟看成大张伟的‍举个✋🏻 好嘛😒 ， 
4884,2016-10-17 08:35 ,爱萝莉丿真是太好了,,大张伟 
4885,2016-10-17 08:35 ,Tripneasy旅行同学,,我左看右看，还以为是大张伟呢！我的天呀... 
4886,2016-10-17 08:35 ,有想法的佩奇,,看错大张伟 
4887,2016-10-17 08:34 ,疯狂出差的小梅子,,我第一眼看成了大张伟 
4888,2016-10-17 08:34 ,梦里何处寻云归,,全都看错了呀 
4889,2016-10-17 08:34 ,八月有个小梨涡,,我还以为是大张伟..... 
4890,2016-10-17 08:34 ,小姑娘失了智,,我竟然看成了大张伟…… 
4891,2016-10-17 08:34 ,水拂袖,,看成大张伟，神之尴尬 
4892,2016-10-17 08:34 ,他呢我的,,吓死还以为是大张伟 
4893,2016-10-17 08:34 ,JacksonYee的楠楠,,大张伟 
4894,2016-10-17 08:34 ,瓶子是个小透明,,看成大张伟＋1 
4895,2016-10-17 08:34 ,记忆中你妖娆的脸,,同 大张伟 
4896,2016-10-17 08:34 ,寻找格尔达,,卧槽我以为大张伟怎么了 
4897,2016-10-17 08:34 ,诗古诗的诗,,真的  看几遍都是大张伟 
4898,2016-10-17 08:34 ,我是苗苗呀98,,我特么看成大张伟了，吓死额了😪 
4899,2016-10-17 08:34 ,王鹤棣是我宝贝,,哈哈哈哈 全是大张伟😂 
4900,2016-10-17 08:33 ,这最暖的冬季,,我也是惊呆了，这新闻真够吓人的 
4901,2016-10-17 08:33 ,我说凌宝儿你说到,,吓我一跳我以为是大厉害那 
4902,2016-10-17 08:33 ,那年那月那日某年某月某日,,看成大张伟了 
4903,2016-10-17 08:33 ,Pink旺,,还以为大老师出什么幺蛾子了 
4904,2016-10-17 08:33 ,Teddy-CY,,吓我一跳，我还以为是大张伟 
4905,2016-10-17 08:33 ,大饼子__呀,,我特么就是以为大张伟来看的，我也说他犯啥事了。 
4906,2016-10-17 08:33 ,yrddfjyjh,,我第一眼“大张伟” 
4907,2016-10-17 08:33 ,力大无穷觉得昵称太长不好你说呢,,看成大张伟+1 
4908,2016-10-17 08:33 ,清淡歡顏小女籽,,大张伟 
4909,2016-10-17 08:33 ,-不明不白也不甜,,我也看成了大张伟 
4910,2016-10-17 08:33 ,2018小海豚baby,,我以为大张伟了 
4911,2016-10-17 08:33 ,扎逗比的小辫子,,大张伟😱😱😱 
4912,2016-10-17 08:33 ,斐不知姓,,我还在想人怎么不对啊😂 
4913,2016-10-17 08:33 ,我是不是林子,,大张伟躺枪 
4914,2016-10-17 08:33 ,zdove,,吓死我了…… 
4915,2016-10-17 08:32 ,不会撩妹的吴彦祖,,看成大张伟的赞我 
4916,2016-10-17 08:32 ,张琳儿R,,看了好几遍都是大张伟，还奇怪他怎么了还自首 
4917,2016-10-17 08:32 ,W-四仰,,我瞪俩大眼就看成大张伟了。 
4918,2016-10-17 08:32 ,抱蜜罐的小熊,,我以为。。。大张伟 
4919,2016-10-17 08:32 ,多多多小多儿,,艾玛我看成了大张伟 
4920,2016-10-17 08:32 ,道书秋水,,大张伟，你赶紧自首！ 
4921,2016-10-17 08:32 ,网络偷心高手,,哈哈哈以为大张伟 
4922,2016-10-17 08:32 ,甜杨_,,看成大张伟了 
4923,2016-10-17 08:32 ,狐狸君123,,我也看成大张伟 
4924,2016-10-17 08:32 ,鑫阳2037,,我特么以为大张伟怎么了~ 
4925,2016-10-17 08:31 ,A婉容,,冲着大张伟来的 
4926,2016-10-17 08:31 ,Sunderelily,,吓得我手机掉地这抄袭还得去投案? 
4927,2016-10-17 08:31 ,酒奺-,,以为是大张伟 
4928,2016-10-17 08:31 ,免我四下流离_,,尼玛大张伟。。。我本来还想说我对他太失望了 又仔细看了一看 哦不是 
4929,2016-10-17 08:31 ,Nicole·J,,😂热搜要变成大张伟了 
4930,2016-10-17 08:31 ,阿giao粉丝团团员,,笑死我了  大张伟 
4931,2016-10-17 08:31 ,天使丹梦,,我还很认真的看了一遍，边看边想大张伟犯什么事了，后来，又看了一遍，哦，是张大伟 
4932,2016-10-17 08:31 ,胡桃夹子zRJ,,看成大张伟的赞我，包括刚刚我还一本正经的在心里默读大张伟………… 
4933,2016-10-17 08:31 ,二藏先生,,妈妈呀，第一反应大张伟他妈的干了什么事儿，回哪国投案自首 
4934,2016-10-17 08:31 ,那些你佷冒险的梦,,大张伟+1 
4935,2016-10-17 08:30 ,李茉L1991,,看成大张伟的不是我一个人 
4936,2016-10-17 08:30 ,BIG丶小图,,大张伟躺着中枪  好无辜 
4937,2016-10-17 08:30 ,彭二小姐YY,,妈的 一大早的 我以为大张伟犯什么事了呢 
4938,2016-10-17 08:30 ,我是你们的罗伯伯,,我看成大张伟 
4939,2016-10-17 08:30 ,都取关吧hh,,妈的，要搞事情啊！吓死我了，还以为我大老师犯啥事了 
4940,2016-10-17 08:30 ,米宝宝爱麻麻,,大张伟，张大伟 
4941,2016-10-17 08:30 ,不妨大爱,,我看成是大张伟了 
4942,2016-10-17 08:30 ,睡懒觉的喵An,,原来不是我一个人看成大张伟！ 
4943,2016-10-17 08:30 ,一只橙_,,看成大张伟的不是我一个 
4944,2016-10-17 08:30 ,水火之中-,,对不起我已经不认识张伟这俩字了 
4945,2016-10-17 08:30 ,张小二tuu,,我看成大张伟  
4946,2016-10-17 08:30 ,anTonybig,,哈哈哈哈 
4947,2016-10-17 08:30 ,恋你霎那芳华,,大张伟，你究竟怎么了？为什么要跟人家重名😂😂😂 
4948,2016-10-17 08:30 ,DonGJiaYuD,,看成大张伟了……我却 
4949,2016-10-17 08:30 ,大脑袋RedQueen,,我也以为是大张伟 
4950,2016-10-17 08:30 ,王星辰QAQ,,我以为是大张伟 
4951,2016-10-17 08:29 ,一个成功的人要学会坚持,,我也看成大张伟了！服了 
4952,2016-10-17 08:29 ,向梦使巧曼,,种类齐全   O网页链接 
4953,2016-10-17 08:29 ,路漫青阳,,真的以为是大张伟 
4954,2016-10-17 08:29 ,朱嘉燚Monkey,,第一眼看成大张伟，第二眼还是大张伟，第三眼还是我决定看一下图片，然后知道错了，再去确定一下名字，然后我就放心了 
4955,2016-10-17 08:29 ,黄论论,,大张伟 
4956,2016-10-17 08:29 ,是阿柔啊,你有没有梦想-Gsf, 233看成大张伟 
4957,2016-10-17 08:29 ,大王叫我来巡山那emp,,看成大张伟 
4958,2016-10-17 08:29 ,胡萝卜超难吃,,我以为是大张伟 
4959,2016-10-17 08:29 ,冰可乐小风扇,,大张伟，张大伟傻傻没看清啊 
4960,2016-10-17 08:28 ,TANGL_in,大张伟的, 
4961,2016-10-17 08:28 ,画本子的Ming,,看成大张伟😂😂😂 
